titulo,tipo_principal,tipo_detalhado,gravidade,validado,tipo_corrigido,observacoes
PM prende jovem por embriaguez ao volante e som alto na zona Leste de Manaus,Não classificado com precisão,Requer análise manual,indefinida,NA,Não classificado com precisão,NA
PM resgata mulher torturada pelo CV em ‘Tribunal do Crime’ em Manaus,Tráfico de Drogas/Facções,Tráfico associado a facção criminosa,alta,NA,Tráfico de Drogas/Facções,NA
"PMAM apreende mais de 250 quelônios, além de pescado e carne de caça ilegais",Não classificado com precisão,Requer análise manual,indefinida,NA,Não classificado com precisão,NA
PMs apreendem 15 quilos de drogas escondidos em garrafões de água,Não classificado com precisão,Requer análise manual,indefinida,NA,Não classificado com precisão,NA
PMs e guarda suspeitos de estuprar indígena são presos após pedido de prisão preventiva do MPAM,Não classificado com precisão,Requer análise manual,indefinida,NA,Não classificado com precisão,NA
PMs e perito da Polícia Civil são presos por atuarem em milícia envolvida em roubos e extorsão,Roubo/Assalto,Roubo/assalto com confronto,alta,NA,Roubo/Assalto,NA
PMs resgatam homem após provável golpe do Rupinol no Coroado,Não classificado com precisão,Requer análise manual,indefinida,NA,Não classificado com precisão,NA
Polícia acaba com venda de droga em praça na zona leste de Manaus,Não classificado com precisão,Requer análise manual,indefinida,NA,Não classificado com precisão,NA
Polícia alerta motoristas de app sobre riscos de alugar contas a terceiros em Manaus,Não classificado com precisão,Requer análise manual,indefinida,NA,Não classificado com precisão,NA
"Polícia alerta para golpe da ligação muda, usado para clonar vozes de vítimas",Não classificado com precisão,Requer análise manual,indefinida,NA,Não classificado com precisão,NA
Polícia alerta sobre medidas preventivas contra golpes virtuais com links e arquivos em ZIP,Não classificado com precisão,Requer análise manual,indefinida,NA,Não classificado com precisão,NA
Polícia aponta indícios de incêndio criminoso que matou avô e neto em Manacapuru,Homicídio,Homicídio consumado,extrema,NA,Homicídio,NA
"Polícia apreende 1,4 tonelada de drogas em operação no interior do Amazonas",Não classificado com precisão,Requer análise manual,indefinida,NA,Não classificado com precisão,NA
"Polícia apreende 120 kg de maconha, avaliados em R$ 2,2 milhões, em barco no Iranduba",Não classificado com precisão,Requer análise manual,indefinida,NA,Não classificado com precisão,NA
Polícia apreende 200 kg de cocaína em laboratório do CV,Tráfico de Drogas/Facções,Tráfico associado a facção criminosa,alta,NA,Tráfico de Drogas/Facções,NA
Polícia apreende 300 kg de maconha e desarticula rinha com 70 galos na Cidade de Deus,Não classificado com precisão,Requer análise manual,indefinida,NA,Não classificado com precisão,NA
Polícia apreende 33 tabletes de maconha do tipo skunk e pasta base de cocaína em Fonte Boa,Não classificado com precisão,Requer análise manual,indefinida,NA,Não classificado com precisão,NA
Polícia apreende 50 kg de skunk avaliados em mais de R$ 1 milhão na BR-319,Não classificado com precisão,Requer análise manual,indefinida,NA,Não classificado com precisão,NA
Polícia apreende 580 kg de maconha avaliados em R$ 8 milhões em Jutaí,Não classificado com precisão,Requer análise manual,indefinida,NA,Não classificado com precisão,NA
"Polícia apreende 583 tabletes de maconha avaliados em mais de R$ 10,5 milhões",Não classificado com precisão,Requer análise manual,indefinida,NA,Não classificado com precisão,NA
Polícia apreende avião com 400 kg de drogas avaliadas em R$ 7 milhões no interior do Amazonas,Não classificado com precisão,Requer análise manual,indefinida,NA,Não classificado com precisão,NA
Polícia apreende cocaína com 100% de pureza escondida em tanque de petróleo de embarcação,Não classificado com precisão,Requer análise manual,indefinida,NA,Não classificado com precisão,NA
"Polícia apreende droga avaliada em R$ 4,6 milhões no interior do Amazonas",Não classificado com precisão,Requer análise manual,indefinida,NA,Não classificado com precisão,NA
Polícia apreende mais de 200kg de maconha em botes parados em flutuante no Tarumã,Não classificado com precisão,Requer análise manual,indefinida,NA,Não classificado com precisão,NA
Polícia apreende mais de 22 kg de drogas e prende suspeito por tráfico de drogas em Barcelos,Tráfico de Drogas/Facções,Tráfico associado a facção criminosa,alta,NA,Tráfico de Drogas/Facções,NA
Polícia apreende mais de 80 kg de maconha em depósito de droga no Tarumã,Não classificado com precisão,Requer análise manual,indefinida,NA,Não classificado com precisão,NA
Polícia apreende mais de uma tonelada de maconha em sítio no Iranduba,Não classificado com precisão,Requer análise manual,indefinida,NA,Não classificado com precisão,NA
"Polícia apreende meia tonelada de maconha, sete fuzis e prende traficante no Educandos",Não classificado com precisão,Requer análise manual,indefinida,NA,Não classificado com precisão,NA
Polícia apreende quase 700 kg de cocaína no rio Solimões,Não classificado com precisão,Requer análise manual,indefinida,NA,Não classificado com precisão,NA
"Polícia apreende quase 700 kg de droga no interior do AM, ninguém foi preso",Não classificado com precisão,Requer análise manual,indefinida,NA,Não classificado com precisão,NA
Polícia apreende quase duas toneladas de drogas em micro-ônibus abandonado em ramal no AM; VÍDEO,Não classificado com precisão,Requer análise manual,indefinida,NA,Não classificado com precisão,NA
"Polícia apreende R$ 1,2 milhão em drogas dentro de embarcação em Coari",Não classificado com precisão,Requer análise manual,indefinida,NA,Não classificado com precisão,NA
"Polícia apreende R$ 1,7 milhão em operação contra o Comando Vermelho no AM",Tráfico de Drogas/Facções,Tráfico associado a facção criminosa,alta,NA,Tráfico de Drogas/Facções,NA
Polícia apreende seis tabletes de oxi em embarcação que saiu de Tabatinga,Não classificado com precisão,Requer análise manual,indefinida,NA,Não classificado com precisão,NA
Polícia apreende três toneladas de drogas em Manacapuru; dois traficantes morreram,Não classificado com precisão,Requer análise manual,indefinida,NA,Não classificado com precisão,NA
"Polícia busca José Brito, suspeito de matar Izabel Simplício com extrema violência em Manaus",Homicídio,Homicídio consumado,extrema,NA,Homicídio,NA
Polícia busca quatro suspeitos de matar irmãos em Manaus,Homicídio,Homicídio consumado,extrema,NA,Homicídio,NA
Polícia captura primeiro de 14 presos que fugiram de penitenciária em Maués,Não classificado com precisão,Requer análise manual,indefinida,NA,Não classificado com precisão,NA
Polícia Civil alerta idosos sobre golpes e reforça atenção nas agências bancárias,Não classificado com precisão,Requer análise manual,indefinida,NA,Não classificado com precisão,NA
Polícia Civil alerta idosos sobre golpes em agências bancárias no Amazonas,Não classificado com precisão,Requer análise manual,indefinida,NA,Não classificado com precisão,NA
Polícia Civil apreende adolescente por ato infracional análogo ao crime de tentativa de homicídio,Homicídio,Homicídio consumado,extrema,NA,Homicídio,NA
"Polícia Civil apreende cocaína avaliada em R$ 19,5 milhões em mansão na Ponta Negra",Não classificado com precisão,Requer análise manual,indefinida,NA,Não classificado com precisão,NA
Polícia Civil apreende segundo adolescente envolvido no assassinato de Fernando Vilaça,Homicídio,Homicídio consumado,extrema,NA,Homicídio,NA
Polícia Civil cumpre prisão de tio e procura pai por abusos no AM,Não classificado com precisão,Requer análise manual,indefinida,NA,Não classificado com precisão,NA
Polícia Civil deflagra cumpre 51 mandados de prisão por inadimplência de pensão alimentícia,Não classificado com precisão,Requer análise manual,indefinida,NA,Não classificado com precisão,NA
Polícia Civil desarticula centro de distribuição de drogas na Zona Norte de Manaus,Não classificado com precisão,Requer análise manual,indefinida,NA,Não classificado com precisão,NA
Polícia Civil desarticula grupo suspeito de roubo de celulares em Manaus,Roubo/Assalto,Roubo/assalto com confronto,alta,NA,Roubo/Assalto,NA
Polícia Civil divulga imagem de dois homens que desapareceram em Manaus,Não classificado com precisão,Requer análise manual,indefinida,NA,Não classificado com precisão,NA
Polícia Civil divulga imagem de homem condenado pelo crime de homicídio em Itapiranga,Homicídio,Homicídio consumado,extrema,NA,Homicídio,NA
Polícia Civil divulga imagem de homem procurado por aplicar golpes no ramo de móveis planejados,Não classificado com precisão,Requer análise manual,indefinida,NA,Não classificado com precisão,NA
Polícia Civil divulga imagem de homem procurado por estupro contra adolescente em Itapiranga,Estupro de Vulnerável,Estupro de criança/adolescente,extrema,NA,Estupro de Vulnerável,NA
Polícia Civil divulga imagem de homem procurado por homicídio em Eirunepé,Homicídio,Homicídio consumado,extrema,NA,Homicídio,NA
Polícia Civil divulga imagem de homem procurado por roubo em drogaria no bairro Japiim,Roubo/Assalto,Roubo/assalto com confronto,alta,NA,Roubo/Assalto,NA
Polícia Civil divulga imagem de homem procurado por roubos na zona norte de Manaus,Roubo/Assalto,Roubo/assalto com confronto,alta,NA,Roubo/Assalto,NA
Polícia Civil divulga imagem de homem que desapareceu durante viagem de Porto Velho a Manaus,Não classificado com precisão,Requer análise manual,indefinida,NA,Não classificado com precisão,NA
Polícia Civil divulga imagem de jovem desaparecido na zona leste de Manaus,Não classificado com precisão,Requer análise manual,indefinida,NA,Não classificado com precisão,NA
Polícia Civil divulga imagem de jovem e adolescente que desapareceram em locais diferentes em Manaus,Não classificado com precisão,Requer análise manual,indefinida,NA,Não classificado com precisão,NA
Polícia Civil divulga imagem de seis pessoas procuradas por tráfico de drogas em Borba,Tráfico de Drogas/Facções,Tráfico associado a facção criminosa,alta,NA,Tráfico de Drogas/Facções,NA
Polícia Civil divulga imagem de suspeito de furtar hidrômetro no bairro Coroado,Não classificado com precisão,Requer análise manual,indefinida,NA,Não classificado com precisão,NA
Polícia Civil do Amazonas alerta sobre golpes online em redes sociais,Não classificado com precisão,Requer análise manual,indefinida,NA,Não classificado com precisão,NA
Polícia Civil do Amazonas lança site da Delegacia Virtual da Mulher,Não classificado com precisão,Requer análise manual,indefinida,NA,Não classificado com precisão,NA
Polícia Civil do Amazonas prende três irmãos por doparem e estuprarem adolescente em Nhamundá,Não classificado com precisão,Requer análise manual,indefinida,NA,Não classificado com precisão,NA
Polícia Civil do Amazonas solicita mais de 12 mil medidas protetivas em 2025,Não classificado com precisão,Requer análise manual,indefinida,NA,Não classificado com precisão,NA
Polícia Civil e Procon realizam fiscalização para coibir venda de bebidas adulteradas na zona leste,Não classificado com precisão,Requer análise manual,indefinida,NA,Não classificado com precisão,NA
Polícia Civil incinera quatro toneladas de entorpecentes apreendidos ao longo deste ano,Não classificado com precisão,Requer análise manual,indefinida,NA,Não classificado com precisão,NA
Polícia Civil investiga esquema de golpes em terrenos e orienta compradores,Não classificado com precisão,Requer análise manual,indefinida,NA,Não classificado com precisão,NA
Polícia Civil prende 22 pessoas por inadimplência de pensão alimentícia,Não classificado com precisão,Requer análise manual,indefinida,NA,Não classificado com precisão,NA
Polícia Civil prende 468 pessoas por abusos contra crianças no AM em 2025,Não classificado com precisão,Requer análise manual,indefinida,NA,Não classificado com precisão,NA
Polícia Civil prende 59 pessoas por inadimplência de pensão alimentícia em Manaus,Não classificado com precisão,Requer análise manual,indefinida,NA,Não classificado com precisão,NA
Polícia Civil prende advogados suspeitos de aplicar golpes contra idosos em Manaus e no interior,Não classificado com precisão,Requer análise manual,indefinida,NA,Não classificado com precisão,NA
"Polícia Civil prende duas mulheres com drogas em embarcação, no porto de Jutaí",Não classificado com precisão,Requer análise manual,indefinida,NA,Não classificado com precisão,NA
Polícia Civil prende falso advogado por aplicar golpe avaliado em mais de R$ 122 mil em idoso,Não classificado com precisão,Requer análise manual,indefinida,NA,Não classificado com precisão,NA
Polícia Civil prende foragido da Justiça por tráfico de drogas no bairro Cidade de Deus,Tráfico de Drogas/Facções,Tráfico associado a facção criminosa,alta,NA,Tráfico de Drogas/Facções,NA
Polícia Civil prende homem condenado a 15 anos de reclusão por estupro de vulnerável,Estupro,Estupro consumado,extrema,NA,Estupro,NA
Polícia Civil prende homem em flagrante por tráfico de drogas e apologia ao crime,Tráfico de Drogas/Facções,Tráfico associado a facção criminosa,alta,NA,Tráfico de Drogas/Facções,NA
Polícia Civil prende homem em Manaus por estupro de vulnerável contra adolescente em Itacoatiara,Estupro de Vulnerável,Estupro de criança/adolescente,extrema,NA,Estupro de Vulnerável,NA
Polícia Civil prende homem envolvido com roubo majorado em drogaria no bairro Santo Antônio,Roubo/Assalto,Roubo/assalto com confronto,alta,NA,Roubo/Assalto,NA
Polícia Civil prende homem foragido do Pará condenado a mais de nove anos por estupro de vulnerável,Estupro,Estupro consumado,extrema,NA,Estupro,NA
Polícia Civil prende homem investigado por estupro de vulnerável contra as primas de 10 e 12 anos,Estupro,Estupro consumado,extrema,NA,Estupro,NA
Polícia Civil prende homem por agredir a ex-companheira em Carauari,Agressão Doméstica,Violência doméstica com lesão corporal,alta,NA,Agressão Doméstica,NA
Polícia Civil prende homem por ameaçar com arma de fogo e injuriar ex-companheira,Não classificado com precisão,Requer análise manual,indefinida,NA,Não classificado com precisão,NA
"Polícia Civil prende homem por apropriação de proventos de idosa, em Juruá",Não classificado com precisão,Requer análise manual,indefinida,NA,Não classificado com precisão,NA
Polícia Civil prende homem por descumprimento de medida e ameaça contra a ex-companheira,Não classificado com precisão,Requer análise manual,indefinida,NA,Não classificado com precisão,NA
Polícia Civil prende homem por estelionato envolvendo compra e venda de veículos em Manaus,Não classificado com precisão,Requer análise manual,indefinida,NA,Não classificado com precisão,NA
Polícia Civil prende homem por feminicídio contra companheira na Zona Leste de Manaus,Não classificado com precisão,Requer análise manual,indefinida,NA,Não classificado com precisão,NA
Polícia Civil prende homem por furto de motocicleta na zona leste de Manaus,Não classificado com precisão,Requer análise manual,indefinida,NA,Não classificado com precisão,NA
Polícia Civil prende homem por importunação sexual contra três mulheres em uma embarcação,Não classificado com precisão,Requer análise manual,indefinida,NA,Não classificado com precisão,NA
Polícia Civil prende homem por lesão corporal e injúria contra companheira no bairro Japiim,Não classificado com precisão,Requer análise manual,indefinida,NA,Não classificado com precisão,NA
Polícia Civil prende homem por lesão corporal gravíssima contra o pai em São Paulo de Olivença,Não classificado com precisão,Requer análise manual,indefinida,NA,Não classificado com precisão,NA
Polícia Civil prende homem por maus-tratos contra cadela no bairro Dom Pedro,Não classificado com precisão,Requer análise manual,indefinida,NA,Não classificado com precisão,NA
Polícia Civil prende homem por roubar vítima enquanto ela aguardava entrega de encomenda,Não classificado com precisão,Requer análise manual,indefinida,NA,Não classificado com precisão,NA
Polícia Civil prende homem por roubo a pastelaria no bairro Flores,Roubo/Assalto,Roubo/assalto com confronto,alta,NA,Roubo/Assalto,NA
Polícia Civil prende homem por tentativa de feminicídio contra a companheira,Não classificado com precisão,Requer análise manual,indefinida,NA,Não classificado com precisão,NA
Polícia Civil prende homem por tentativa de feminicídio contra a ex-companheira,Não classificado com precisão,Requer análise manual,indefinida,NA,Não classificado com precisão,NA
Polícia Civil prende homem que aplicou golpe do investimento superior a R$ 450 mil,Não classificado com precisão,Requer análise manual,indefinida,NA,Não classificado com precisão,NA
Polícia Civil prende homem que matou jovem a facadas em Urucurituba,Homicídio,Homicídio consumado,extrema,NA,Homicídio,NA
Polícia Civil prende homem que usava aplicativo de relacionamento para furtar bens de vítimas,Não classificado com precisão,Requer análise manual,indefinida,NA,Não classificado com precisão,NA
Polícia Civil prende mandante da morte de advogado e servidor do TCE-AM,Homicídio,Homicídio consumado,extrema,NA,Homicídio,NA
Polícia Civil prende mulher condenada a mais de nove anos de prisão por tortura contra três enteados,Não classificado com precisão,Requer análise manual,indefinida,NA,Não classificado com precisão,NA
"Polícia Civil prende principal suspeito de matar mulher e lançar o corpo no rio Purus, em Tapauá",Homicídio,Homicídio consumado,extrema,NA,Homicídio,NA
Polícia Civil prende suspeito de homicídio qualificado praticado em Santo Antônio do Içá,Homicídio,Homicídio consumado,extrema,NA,Homicídio,NA
Polícia Civil prende trio por receptação de objetos furtados de residência em Santo Antônio do Içá,Agressão com Objeto,Lesão com instrumento contundente,alta,NA,Agressão com Objeto,NA
Polícia cumpre mandado na casa de secretário investigado por atividades criminosas em Envira,Não classificado com precisão,Requer análise manual,indefinida,NA,Não classificado com precisão,NA
Polícia da ROCAM desmontam ponto de drogas em condomínio no Tarumã; cinco pessoas foram presas,Não classificado com precisão,Requer análise manual,indefinida,NA,Não classificado com precisão,NA
Polícia deflaga operação e desarticula organizações criminosas ligadas ao tráfico de drogas em Borba,Tráfico de Drogas/Facções,Tráfico associado a facção criminosa,alta,NA,Tráfico de Drogas/Facções,NA
Polícia deflagra operação contra fraudes eletrônicas a idosos,Não classificado com precisão,Requer análise manual,indefinida,NA,Não classificado com precisão,NA
Polícia deflagra Operação Reação e prende membros de organização criminosa em Lábrea,Não classificado com precisão,Requer análise manual,indefinida,NA,Não classificado com precisão,NA
Polícia desarticula ‘boca de fumo’ no Tancredo Neves,Não classificado com precisão,Requer análise manual,indefinida,NA,Não classificado com precisão,NA
Polícia desarticula grupo especializado em estelionato com falsos escritórios de venda de veículos,Não classificado com precisão,Requer análise manual,indefinida,NA,Não classificado com precisão,NA
Polícia desarticula laboratório de droga na zona norte de Manaus; traficantes fugiram do local,Não classificado com precisão,Requer análise manual,indefinida,NA,Não classificado com precisão,NA
Polícia desarticula organização criminosa que atuava no tráfico de drogas em Caapiranga,Tráfico de Drogas/Facções,Tráfico associado a facção criminosa,alta,NA,Tráfico de Drogas/Facções,NA
Polícia desarticula pista clandestina e prende suspeito por crimes ambientais no interior do AM,Não classificado com precisão,Requer análise manual,indefinida,NA,Não classificado com precisão,NA
Polícia desarticula ponto de distribuição de droga na Betânia e prende traficante de 18 anos,Não classificado com precisão,Requer análise manual,indefinida,NA,Não classificado com precisão,NA
Polícia descobre 8 kg de maconha escondidos em colchão de barco no AM,Não classificado com precisão,Requer análise manual,indefinida,NA,Não classificado com precisão,NA
Polícia desmonta bando suspeito de série de assaltos em Manaus,Roubo/Assalto,Roubo/assalto com confronto,alta,NA,Roubo/Assalto,NA
Polícia desmonta ponto de venda de drogas e prende mulher de traficante na zona norte de Manaus,Não classificado com precisão,Requer análise manual,indefinida,NA,Não classificado com precisão,NA
Polícia destrói helicóptero usando para o tráfico de drogas no interior do AM,Tráfico de Drogas/Facções,Tráfico associado a facção criminosa,alta,NA,Tráfico de Drogas/Facções,NA
Polícia divulga foto de homem suspeito de séries de furtos na zona centro-sul de Manaus,Não classificado com precisão,Requer análise manual,indefinida,NA,Não classificado com precisão,NA
Polícia divulga fotos de detentos que fugiram de prisão em Maués no AM,Não classificado com precisão,Requer análise manual,indefinida,NA,Não classificado com precisão,NA
Polícia divulga imagem de adolescente que desapareceu no bairro Compensa,Não classificado com precisão,Requer análise manual,indefinida,NA,Não classificado com precisão,NA
Polícia divulga imagem de adolescente que desapareceu no bairro Santa Etelvina,Não classificado com precisão,Requer análise manual,indefinida,NA,Não classificado com precisão,NA
Polícia divulga imagem de assaltante de ônibus que agia na zona leste,Não classificado com precisão,Requer análise manual,indefinida,NA,Não classificado com precisão,NA
Polícia divulga imagem de assaltantes da linha de ônibus 358,Não classificado com precisão,Requer análise manual,indefinida,NA,Não classificado com precisão,NA
Polícia divulga imagem de casal procurado por roubo a ônibus da linha 560,Roubo/Assalto,Roubo/assalto com confronto,alta,NA,Roubo/Assalto,NA
Polícia divulga imagem de homem condenado pelo crime de estupro de vulnerável em Humaitá,Estupro,Estupro consumado,extrema,NA,Estupro,NA
Polícia divulga imagem de homem flagrado em ato obsceno dentro de UBS em Manaus,Não classificado com precisão,Requer análise manual,indefinida,NA,Não classificado com precisão,NA
Polícia divulga imagem de homem procurado por agredir a ex-companheira,Agressão Doméstica,Violência doméstica com lesão corporal,alta,NA,Agressão Doméstica,NA
Polícia divulga imagem de homem procurado por diversos crimes em Manaus,Não classificado com precisão,Requer análise manual,indefinida,NA,Não classificado com precisão,NA
Polícia divulga imagem de homem procurado por estuprar a própria filha,Não classificado com precisão,Requer análise manual,indefinida,NA,Não classificado com precisão,NA
"Polícia divulga imagem de homem procurado por lesão corporal, perseguição, ameaça outros crimes",Não classificado com precisão,Requer análise manual,indefinida,NA,Não classificado com precisão,NA
Polícia divulga imagem de homem procurado por matar vizinho a facadas no bairro Jorge Teixeira,Homicídio,Homicídio consumado,extrema,NA,Homicídio,NA
Polícia divulga imagem de homem procurado por roubo em unidade de saúde na zona leste,Roubo/Assalto,Roubo/assalto com confronto,alta,NA,Roubo/Assalto,NA
Polícia divulga imagem de homem procurado por tentativa de homicídio em São Gabriel da Cachoeira,Homicídio,Homicídio consumado,extrema,NA,Homicídio,NA
Polícia divulga imagem de homem que esfaqueou cadela grávida no bairro Santa Etelvina,Não classificado com precisão,Requer análise manual,indefinida,NA,Não classificado com precisão,NA
Polícia divulga imagem de homem suspeito de envolvimento no desaparecimento da esposa e enteados,Não classificado com precisão,Requer análise manual,indefinida,NA,Não classificado com precisão,NA
Polícia divulga imagem de motorista de aplicativo procurado por lesão corporal e roubo em Flores,Roubo/Assalto,Roubo/assalto com confronto,alta,NA,Roubo/Assalto,NA
Polícia divulga imagens de duas pessoas desaparecidas em Manaus,Não classificado com precisão,Requer análise manual,indefinida,NA,Não classificado com precisão,NA
Polícia divulga imagens de quatro homens procurados pelos homicídios de dois irmãos no Alvorada,Homicídio,Homicídio consumado,extrema,NA,Homicídio,NA
"Polícia divulga imagens suspeitos de vários roubos a ônibus das linhas 640 e 652, em Manaus",Roubo/Assalto,Roubo/assalto com confronto,alta,NA,Roubo/Assalto,NA
Polícia do RJ deflagra ofensiva contra finanças do CV,Tráfico de Drogas/Facções,Tráfico associado a facção criminosa,alta,NA,Tráfico de Drogas/Facções,NA
Polícia é acionada após roubo a joalheria em shopping de Manaus,Roubo/Assalto,Roubo/assalto com confronto,alta,NA,Roubo/Assalto,NA
Polícia encontra 34 kg de cocaína negra avaliados em mais de R$ 18 milhões em mansão na Ponta Negra,Não classificado com precisão,Requer análise manual,indefinida,NA,Não classificado com precisão,NA
Polícia encontra destroços de helicóptero às margens de um lago em Juruá; havia droga no local,Não classificado com precisão,Requer análise manual,indefinida,NA,Não classificado com precisão,NA
Polícia está procurando mulher que assassinou o ex-marido,Homicídio,Homicídio consumado,extrema,NA,Homicídio,NA
