titulo,tipo_principal,tipo_detalhado,gravidade,validado,tipo_corrigido,observacoes
Jovem é preso novamente por enviar drogas escondidas em barra de sabão para delegacia,Não classificado com precisão,Requer análise manual,indefinida,NA,Não classificado com precisão,NA
Jovem é preso por agredir e ameaçar ex na Zona Norte de Manaus,Agressão Doméstica,Violência doméstica com lesão corporal,alta,NA,Agressão Doméstica,NA
Jovem é preso por agressão física e descumprimento de medida protetiva contra ex-companheira,Não classificado com precisão,Requer análise manual,indefinida,NA,Não classificado com precisão,NA
Jovem é preso por dopar e abusar sexualmente de adolescente em Beruri,Não classificado com precisão,Requer análise manual,indefinida,NA,Não classificado com precisão,NA
Jovem é preso por extorquir mãe idosa para conseguir dinheiro para drogas no AM,Não classificado com precisão,Requer análise manual,indefinida,NA,Não classificado com precisão,NA
Jovem é preso por roubar grávida em ônibus da linha 652,Não classificado com precisão,Requer análise manual,indefinida,NA,Não classificado com precisão,NA
Jovem é preso por roubo de R$ 25 mil e celular em posto de combustível no AM,Roubo/Assalto,Roubo/assalto com confronto,alta,NA,Roubo/Assalto,NA
"Jovem é preso por tráfico de drogas em área conhecida como 'Buracão', na zona Leste de Manaus",Tráfico de Drogas/Facções,Tráfico associado a facção criminosa,alta,NA,Tráfico de Drogas/Facções,NA
Jovem é preso por usar Free Fire para abusar e enviar mensagens racistas a crianças no AM,Não classificado com precisão,Requer análise manual,indefinida,NA,Não classificado com precisão,NA
Jovem é preso suspeito de lesão corporal e violência doméstica na zona Norte de Manaus,Não classificado com precisão,Requer análise manual,indefinida,NA,Não classificado com precisão,NA
Jovem é preso suspeito de tentar matar duas mulheres em Manaus,Homicídio,Homicídio consumado,extrema,NA,Homicídio,NA
Jovem é sequestrado de dentro de casa e encontrado morto e com sinais de tortura na zona norte,Homicídio,Homicídio consumado,extrema,NA,Homicídio,NA
Jovem escapa de porta-malas após ser sequestrado em Manaus,Sequestro/Cárcere Privado,Privação de liberdade com restrição,muito alta,NA,Sequestro/Cárcere Privado,NA
Jovem exige dinheiro do avô para comprar drogas e acaba preso no AM,Não classificado com precisão,Requer análise manual,indefinida,NA,Não classificado com precisão,NA
"Jovem foi assassinada a mando da irmã e do cunhado em Manacapuru, aponta polícia",Homicídio,Homicídio consumado,extrema,NA,Homicídio,NA
Jovem mata mãe e acaba executado pelo Tribunal do Crime em Manaus,Homicídio,Homicídio consumado,extrema,NA,Homicídio,NA
Jovem morre após grave acidente entre motocicletas em Manaus,Não classificado com precisão,Requer análise manual,indefinida,NA,Não classificado com precisão,NA
Jovem morre após tomar remédio para disfunção erétil antes de jogar futebol,Não classificado com precisão,Requer análise manual,indefinida,NA,Não classificado com precisão,NA
Jovem morre em confronto com a Rocam no Jorge Teixeira,Não classificado com precisão,Requer análise manual,indefinida,NA,Não classificado com precisão,NA
Jovem que agrediu e matou cachorro é preso em Borba,Homicídio,Homicídio consumado,extrema,NA,Homicídio,NA
Jovem reage a assalto e acerta ‘ripada’ em suspeito armado na orla de Itacoatiara,Roubo/Assalto,Roubo/assalto com confronto,alta,NA,Roubo/Assalto,NA
Jovem simula próprio sequestro para extorquir a mãe,Sequestro/Cárcere Privado,Privação de liberdade com restrição,muito alta,NA,Sequestro/Cárcere Privado,NA
Julgamento da morte da PM Deusiane termina com policiais inocentados,Homicídio,Homicídio consumado,extrema,NA,Homicídio,NA
Julgamento de policiais militares envovidos em morte de soldado é adiado,Homicídio,Homicídio consumado,extrema,NA,Homicídio,NA
Justiça autoriza e “Dama do Tráfico” vai cumprir prisão domiciliar,Tráfico de Drogas/Facções,Tráfico associado a facção criminosa,alta,NA,Tráfico de Drogas/Facções,NA
"Justiça concede liberdade a esposa de “Alan Índio”, alvo da operação Xeque-Mate",Não classificado com precisão,Requer análise manual,indefinida,NA,Não classificado com precisão,NA
Justiça concede regime de semiliberdade a indígena que denunciou estupros em delegacia no interior,Estupro,Estupro consumado,extrema,NA,Estupro,NA
Justiça condena a 28 anos de prisão de líder de tráfico interestadual e lavagem de dinheiro no AM,Tráfico de Drogas/Facções,Tráfico associado a facção criminosa,alta,NA,Tráfico de Drogas/Facções,NA
Justiça condena falsa médica por exercício ilegal da medicina em Manaus,Não classificado com precisão,Requer análise manual,indefinida,NA,Não classificado com precisão,NA
Justiça condena sete por tráfico e lavagem de dinheiro no AM; líder pega até 28 anos,Tráfico de Drogas/Facções,Tráfico associado a facção criminosa,alta,NA,Tráfico de Drogas/Facções,NA
Justiça decreta prisão do suspeito de matar borracheiro após discussão por volume de música em Manaus,Homicídio,Homicídio consumado,extrema,NA,Homicídio,NA
Justiça decreta prisão preventiva de envolvido em acidente que matou duas pessoas em Manaus,Homicídio,Homicídio consumado,extrema,NA,Homicídio,NA
Justiça do AM concede habeas corpus a Rosinaldo Bual e determina uso de tornozeleira eletrônica,Não classificado com precisão,Requer análise manual,indefinida,NA,Não classificado com precisão,NA
Justiça do Amazonas revoga habeas corpus de médica do caso Benício,Não classificado com precisão,Requer análise manual,indefinida,NA,Não classificado com precisão,NA
Justiça do Rio avalia validade da polêmica “gratificação faroeste”,Não classificado com precisão,Requer análise manual,indefinida,NA,Não classificado com precisão,NA
Justiça do Rio de Janeiro revoga prisão do MC Poze do Rodo,Não classificado com precisão,Requer análise manual,indefinida,NA,Não classificado com precisão,NA
Justiça Federal aceita denúncia contra grupo acusado de agredir agente da PF em Manaus,Não classificado com precisão,Requer análise manual,indefinida,NA,Não classificado com precisão,NA
Justiça mantém a prisão do MC Poze do Rodo por 30 dias,Não classificado com precisão,Requer análise manual,indefinida,NA,Não classificado com precisão,NA
Justiça mantém prisão de Rosinaldo Bual após audiência de custódia,Não classificado com precisão,Requer análise manual,indefinida,NA,Não classificado com precisão,NA
Justiça rejeita plano da prefeitura e manda iniciar retirada de flutuantes do Tarumã-Açu em 2026,Não classificado com precisão,Requer análise manual,indefinida,NA,Não classificado com precisão,NA
Justiça solta acusado de matar palestino em Manaus e mantém júri popular,Homicídio,Homicídio consumado,extrema,NA,Homicídio,NA
Laboratório clandestino de bebidas falsificadas é desarticulado em casa no Jorge Teixeira,Não classificado com precisão,Requer análise manual,indefinida,NA,Não classificado com precisão,NA
Leilão da Polícia Civil de veículos apreendidos no AM acontece dia 11 de dezembro,Não classificado com precisão,Requer análise manual,indefinida,NA,Não classificado com precisão,NA
Líder evangélico é preso suspeito de estuprar adolescente em acampamento no AM,Não classificado com precisão,Requer análise manual,indefinida,NA,Não classificado com precisão,NA
"Líder na região norte, Amazonas é o 6° estado que mais apreende drogas no país",Não classificado com precisão,Requer análise manual,indefinida,NA,Não classificado com precisão,NA
Líderes do CV-AM pagam até R$ 150 mil por mês para se proteger no Rio,Tráfico de Drogas/Facções,Tráfico associado a facção criminosa,alta,NA,Tráfico de Drogas/Facções,NA
Linchamento: grupo de moradores da Raíz assassinam suspeito de assaltos e deixam outro ferido,Homicídio,Homicídio consumado,extrema,NA,Homicídio,NA
Lula celebra retirada de tarifas pelos EUA e diz que sinaliza respeito,Não classificado com precisão,Requer análise manual,indefinida,NA,Não classificado com precisão,NA
Lula sanciona lei que torna Belém capital do Brasil durante a COP30,Não classificado com precisão,Requer análise manual,indefinida,NA,Não classificado com precisão,NA
Lutador de jiu-jítsu é preso por lesão corporal e injúria contra ex-companheira,Não classificado com precisão,Requer análise manual,indefinida,NA,Não classificado com precisão,NA
Lyon anuncia contratação por empréstimo do atacante Endrick,Não classificado com precisão,Requer análise manual,indefinida,NA,Não classificado com precisão,NA
Made In Amazon: plataforma conecta artesãos do interior do Amazonas a consumidores do mundo todo,Não classificado com precisão,Requer análise manual,indefinida,NA,Não classificado com precisão,NA
"Mãe chega de festa e dorme em cima de bebê de dois meses, que morreu asfixiado",Não classificado com precisão,Requer análise manual,indefinida,NA,Não classificado com precisão,NA
Mãe da influenciadora Isabelly Aurora é encontrada morta em Manaus,Não classificado com precisão,Requer análise manual,indefinida,NA,Não classificado com precisão,NA
Mãe de amigo de Benício relata dor do filho após morte em Manaus: ‘Ele está incompleto’,Homicídio,Homicídio consumado,extrema,NA,Homicídio,NA
Mãe denuncia e idoso é preso por estupro de amiga da filha,Estupro de Vulnerável,Estupro de criança/adolescente,extrema,NA,Estupro de Vulnerável,NA
Mãe e ex-padrasto são presos por exploração e abuso sexual contra adolescente,Abuso Sexual,Abuso sexual consumado,muito alta,NA,Abuso Sexual,NA
Mãe e filha são identificadas após abandonar filhotes em matagal de Manaus,Não classificado com precisão,Requer análise manual,indefinida,NA,Não classificado com precisão,NA
Mãe e filha são presas em embarcação com mais de 5 kg de drogas escondidos nos corpos,Não classificado com precisão,Requer análise manual,indefinida,NA,Não classificado com precisão,NA
Mãe e padrasto são presos por estupro de vulnerável contra adolescente de 14 anos,Estupro de Vulnerável,Estupro de criança/adolescente,extrema,NA,Estupro de Vulnerável,NA
Mãe e padrasto são presos suspeitos de estuprar e filmar menina de 3 anos,Não classificado com precisão,Requer análise manual,indefinida,NA,Não classificado com precisão,NA
Mãe é presa por abandonar filha ferida no olho em rua de Borba,Não classificado com precisão,Requer análise manual,indefinida,NA,Não classificado com precisão,NA
Mãe é presa suspeita de matar filha de 1 ano com múltiplos ferimentos,Homicídio,Homicídio consumado,extrema,NA,Homicídio,NA
Mãe encontra filho morto em casa no Tancredo Neves e polícia investiga possível crime,Homicídio,Homicídio consumado,extrema,NA,Homicídio,NA
Mãe flagra companheiro estuprando filha de 10 anos em Manaus,Estupro de Vulnerável,Estupro de criança/adolescente,extrema,NA,Estupro de Vulnerável,NA
Mãe saía de casa para marido estuprar a filha no AM e depois a entregou para outro abusador,Não classificado com precisão,Requer análise manual,indefinida,NA,Não classificado com precisão,NA
Mais de 1 tonelada de skunk é apreendida em sítio no AM; cinco são presos,Não classificado com precisão,Requer análise manual,indefinida,NA,Não classificado com precisão,NA
Mais de 10 detentos fogem de presídio recém-inaugurado no AM na véspera de Natal,Não classificado com precisão,Requer análise manual,indefinida,NA,Não classificado com precisão,NA
Mais de 100 tabletes de drogas foram apreendidas em embarcação que seguia de Tabatinga para Manaus,Não classificado com precisão,Requer análise manual,indefinida,NA,Não classificado com precisão,NA
Mais de 130 veículos adulterados ou roubados são apreendidos durante operação da polícia no AM,Não classificado com precisão,Requer análise manual,indefinida,NA,Não classificado com precisão,NA
Mais de 146 kg de drogas são apreendidos em estacionamento de supermercado em Manaus,Não classificado com precisão,Requer análise manual,indefinida,NA,Não classificado com precisão,NA
Mais de 15 periquitos são resgatados após serem atropelados em avenida de Manaus,Não classificado com precisão,Requer análise manual,indefinida,NA,Não classificado com precisão,NA
Mais de 170 kg de droga são apreendidos em embarcação no interior do AM,Não classificado com precisão,Requer análise manual,indefinida,NA,Não classificado com precisão,NA
"Mais de 2,5 toneladas de pescado ilegal são apreendidas perto de Coari",Não classificado com precisão,Requer análise manual,indefinida,NA,Não classificado com precisão,NA
Mais de 20 animais são resgatados de canil clandestino desarticulado pela Sepet,Não classificado com precisão,Requer análise manual,indefinida,NA,Não classificado com precisão,NA
Mais de 20 ‘bocas de fumo’ são desarticuladas durante operação em Maraã,Não classificado com precisão,Requer análise manual,indefinida,NA,Não classificado com precisão,NA
Mais de 20 criminosos do Amazonas estão escondidos em favelas do Rio de Janeiro,Não classificado com precisão,Requer análise manual,indefinida,NA,Não classificado com precisão,NA
Mais de 400 pessoas são presas por estupro e crimes contra crianças e adolescentes em 2025 no Amazonas,Estupro de Vulnerável,Estupro de criança/adolescente,extrema,NA,Estupro de Vulnerável,NA
Mais de 450 veículos foram consumidos pelo fogo durante incêndio em fábrica,Não classificado com precisão,Requer análise manual,indefinida,NA,Não classificado com precisão,NA
Mais de 50 mil inscritos fazem provas do concurso da Aleam neste domingo; confira horários e locais,Não classificado com precisão,Requer análise manual,indefinida,NA,Não classificado com precisão,NA
Mais de uma tonelada de droga é apreendida em ação policial no interior do AM,Não classificado com precisão,Requer análise manual,indefinida,NA,Não classificado com precisão,NA
Mais dois criminosos do Amazonas estão entre os mortos em ação no Rio de Janeiro,Homicídio,Homicídio consumado,extrema,NA,Homicídio,NA
Mais um foragido da Justiça é preso em ação entre Guarda Municipal e PF em Manaus,Não classificado com precisão,Requer análise manual,indefinida,NA,Não classificado com precisão,NA
“Malvadão do Jorge Teixeira” é preso em flagrante por tráfico de drogas na zona Leste de Manaus,Tráfico de Drogas/Facções,Tráfico associado a facção criminosa,alta,NA,Tráfico de Drogas/Facções,NA
Manauara é assassinada a facadas pelo ex-marido em Mato Grosso no dia do aniversário,Homicídio,Homicídio consumado,extrema,NA,Homicídio,NA
Manauara EC anuncia Marinho como novo técnico da equipe Sub-20,Não classificado com precisão,Requer análise manual,indefinida,NA,Não classificado com precisão,NA
Manaus entra em estado de atenção por chuvas intensas nesta sexta-feira,Não classificado com precisão,Requer análise manual,indefinida,NA,Não classificado com precisão,NA
Manaus estende vacinação contra HPV para público entre 15 a 19 anos até o primeiro semestre de 2026,Não classificado com precisão,Requer análise manual,indefinida,NA,Não classificado com precisão,NA
Manaus FC oficializa retorno do zagueiro Luis Fernando para sequência da Série D,Não classificado com precisão,Requer análise manual,indefinida,NA,Não classificado com precisão,NA
"Manaus registra queda recorde de 60% nos roubos de celular, aponta SSP-AM",Roubo/Assalto,Roubo/assalto com confronto,alta,NA,Roubo/Assalto,NA
Manifestantes fazem ato em Manaus contra PL da Dosimetria e anistia a condenados pelo 8/1,Não classificado com precisão,Requer análise manual,indefinida,NA,Não classificado com precisão,NA
Maquinista é assassinado a tiros em comunidade no bairro Compensa,Homicídio,Homicídio consumado,extrema,NA,Homicídio,NA
Marido agride esposa na rua e acaba preso em flagrante no AM,Não classificado com precisão,Requer análise manual,indefinida,NA,Não classificado com precisão,NA
Marido é preso após chegar em casa bêbado e agredir esposa no AM,Agressão Doméstica,Violência doméstica com lesão corporal,alta,NA,Agressão Doméstica,NA
Marido é preso por agredir companheira e jogá-la para fora casa no interior do AM,Agressão Doméstica,Violência doméstica com lesão corporal,alta,NA,Agressão Doméstica,NA
Marido é preso por agredir e tentar matar companheira dentro de escola no Amazonas,Homicídio,Homicídio consumado,extrema,NA,Homicídio,NA
Marido é preso por agredir esposa grávida com socos e chutes em Manaus,Agressão Doméstica,Violência doméstica com lesão corporal,alta,NA,Agressão Doméstica,NA
Marido é preso por torturar brutalmente esposa no AM; vítima apanhou até desmaiar,Não classificado com precisão,Requer análise manual,indefinida,NA,Não classificado com precisão,NA
"Marido é suspeito de assassinar esposa com mais de dez facadas, trancar o corpo em casa e fugir",Homicídio,Homicídio consumado,extrema,NA,Homicídio,NA
Marinheiro é morto após briga em casa durante jogo de dominó no AM,Homicídio,Homicídio consumado,extrema,NA,Homicídio,NA
"‘Matei porque estava irado’, diz assassino de pai e filho, de apenas dois anos",Homicídio,Homicídio consumado,extrema,NA,Homicídio,NA
'Matheus e Cauã' são presos por assalto no interior do Amazonas,Roubo/Assalto,Roubo/assalto com confronto,alta,NA,Roubo/Assalto,NA
Matrículas 2026: veja calendário das redes estadual e municipal do AM,Não classificado com precisão,Requer análise manual,indefinida,NA,Não classificado com precisão,NA
MC Thiago Braga é assassinado com golpe de facão na zona sul de Manaus,Homicídio,Homicídio consumado,extrema,NA,Homicídio,NA
Médico é preso pela PF por faltar em parto que resultou na morte de bebê no AM,Homicídio,Homicídio consumado,extrema,NA,Homicídio,NA
Médico é preso por homicídio qualificado após morte de recém-nascido em Eirunepé,Homicídio,Homicídio consumado,extrema,NA,Homicídio,NA
"""Medusa"" é presa na zona Norte de Manaus por praticar golpes contra empresa de moda fitness",Não classificado com precisão,Requer análise manual,indefinida,NA,Não classificado com precisão,NA
Megaoperação no Rio de Janeiro deixa mortos e presos em ofensiva contra o Comando Vermelho,Homicídio,Homicídio consumado,extrema,NA,Homicídio,NA
Megaoperação prende 18 suspeitos por sequestros e assassinatos no Amazonas,Homicídio,Homicídio consumado,extrema,NA,Homicídio,NA
Menina de 12 anos planejou morte da mãe para receber R$ 16 mil de benefício e por proibição de sair,Homicídio,Homicídio consumado,extrema,NA,Homicídio,NA
Menina de 12 é apreendia por ter planejado assassinato da mãe; autor do crime foi preso,Homicídio,Homicídio consumado,extrema,NA,Homicídio,NA
Menina é resgatada em terreno baldio após sofrer sequestro e abuso,Sequestro/Cárcere Privado,Privação de liberdade com restrição,muito alta,NA,Sequestro/Cárcere Privado,NA
Menino de 4 anos morre afogado em piscina de casa onde pais faziam trabalho em Manaus,Não classificado com precisão,Requer análise manual,indefinida,NA,Não classificado com precisão,NA
Menino denuncia padrasto por estupro da irmã; suspeito é preso no AM,Estupro,Estupro consumado,extrema,NA,Estupro,NA
Menino desaparecido é encontrado morto dentro de mala em cemitério,Homicídio,Homicídio consumado,extrema,NA,Homicídio,NA
‘Messi’ é preso em flagrante vendendo drogas na zona leste de Manaus,Não classificado com precisão,Requer análise manual,indefinida,NA,Não classificado com precisão,NA
Militar do Exército morre em acidente de moto na Zona Sul de Manaus,Não classificado com precisão,Requer análise manual,indefinida,NA,Não classificado com precisão,NA
"Militar é preso após furtar mais de 1,5 mil munições de fuzil do CIGS em Manaus",Não classificado com precisão,Requer análise manual,indefinida,NA,Não classificado com precisão,NA
Militares da FAB são presos em Manaus e SP por fraude milionária com milhas e cashback,Não classificado com precisão,Requer análise manual,indefinida,NA,Não classificado com precisão,NA
Milton Hatoum lança ‘Dança de enganos’ e ‘A natureza como ficção’ em Manaus,Não classificado com precisão,Requer análise manual,indefinida,NA,Não classificado com precisão,NA
Ministério Público vai recorrer da absolvição de policiais no caso Deusiane,Não classificado com precisão,Requer análise manual,indefinida,NA,Não classificado com precisão,NA
Ministra da Mulher critica vereadora de Borba e anuncia conferência em Manaus,Não classificado com precisão,Requer análise manual,indefinida,NA,Não classificado com precisão,NA
‘Mito da 14’ é preso pela Rocam com arma carregada na BR-174,Não classificado com precisão,Requer análise manual,indefinida,NA,Não classificado com precisão,NA
‘MK’ é preso na zona leste após tentativa de fuga e apreensão de drogas,Não classificado com precisão,Requer análise manual,indefinida,NA,Não classificado com precisão,NA
Moradora acusa tenente do Corpo de Bombeiros de agressão em condomínio,Não classificado com precisão,Requer análise manual,indefinida,NA,Não classificado com precisão,NA
Moradores de Boa Vista do Ramos realizam manifestação para exigir manutenção de prisão de detento,Não classificado com precisão,Requer análise manual,indefinida,NA,Não classificado com precisão,NA
Moradores denunciam falta de água há mais de um mês em bairro na Zona Norte de Manaus,Não classificado com precisão,Requer análise manual,indefinida,NA,Não classificado com precisão,NA
Moradores do Tarumã encontram homem morto e polícia atribui o crime a duelo de facções,Homicídio,Homicídio consumado,extrema,NA,Homicídio,NA
Morre investigador afastado após denúncia de sexo com presos em delegacia do AM,Não classificado com precisão,Requer análise manual,indefinida,NA,Não classificado com precisão,NA
Morre jovem resgatado em carro arrastado por enxurrada durante temporal em Manaus,Não classificado com precisão,Requer análise manual,indefinida,NA,Não classificado com precisão,NA
Morre segunda vítima de grave acidente de trânsito na Zona Leste de Manaus,Não classificado com precisão,Requer análise manual,indefinida,NA,Não classificado com precisão,NA
"Morre terceira vítima de acidente de trânsito no Distrito Industrial, em Manaus",Não classificado com precisão,Requer análise manual,indefinida,NA,Não classificado com precisão,NA
Moto é furtada de residência no Armando Mendes; proprietário pede ajuda,Não classificado com precisão,Requer análise manual,indefinida,NA,Não classificado com precisão,NA
Motociclista de aplicativo é assassinado a facadas durante corrida em Manaus,Homicídio,Homicídio consumado,extrema,NA,Homicídio,NA
Motociclista de app desaparece após corrida de Manaus para Iranduba,Não classificado com precisão,Requer análise manual,indefinida,NA,Não classificado com precisão,NA
Motociclista interrompe apresentação com barulho de escapamento e dispara tiro no AM,Não classificado com precisão,Requer análise manual,indefinida,NA,Não classificado com precisão,NA
Motociclista morre após colisão entre carro e moto no Centro de Manaus,Não classificado com precisão,Requer análise manual,indefinida,NA,Não classificado com precisão,NA
Motorista de aplicativo é resgatado de sequestro pela ROCAM na zona leste de Manaus,Sequestro/Cárcere Privado,Privação de liberdade com restrição,muito alta,NA,Sequestro/Cárcere Privado,NA
Motorista de aplicativo nega agressão e diz ter provas contra acusação em Manaus,Não classificado com precisão,Requer análise manual,indefinida,NA,Não classificado com precisão,NA
Motorista de aplicativo por moto que estuprou passageira de 22 anos é preso em Manaus,Estupro,Estupro consumado,extrema,NA,Estupro,NA
Motorista de app é morto a facadas em Manaus; corpo foi encontrado jogado em rua,Homicídio,Homicídio consumado,extrema,NA,Homicídio,NA
Motorista de app é preso por estuprar e roubar passageira após corrida em Manaus,Não classificado com precisão,Requer análise manual,indefinida,NA,Não classificado com precisão,NA
Motorista de app é preso suspeito de estuprar enteada de 8 anos em Manaus,Não classificado com precisão,Requer análise manual,indefinida,NA,Não classificado com precisão,NA
Motorista de app é procurado suspeito de estuprar adolescente de 13 anos em Manaus,Não classificado com precisão,Requer análise manual,indefinida,NA,Não classificado com precisão,NA
Motorista é atropelado por ônibus em Manaus ao descer de carro após engavetamento,Não classificado com precisão,Requer análise manual,indefinida,NA,Não classificado com precisão,NA
Motorista é detido por adulterar placa de moto com fita adesiva em Manaus,Não classificado com precisão,Requer análise manual,indefinida,NA,Não classificado com precisão,NA
Motorista é preso ao transportar 7 mil litros de soda cáustica sem autorização,Não classificado com precisão,Requer análise manual,indefinida,NA,Não classificado com precisão,NA
Motorista é preso por dirigir bêbado e causar acidente que matou jovem no AM,Homicídio,Homicídio consumado,extrema,NA,Homicídio,NA
Motorista por aplicativo é procurado pela Polícia Civil suspeito de estuprar adolescente de 13 anos,Não classificado com precisão,Requer análise manual,indefinida,NA,Não classificado com precisão,NA
Motorista que atropelou e matou jovem na Av. Joaquim Nabuco é preso na zona Sul de Manaus,Homicídio,Homicídio consumado,extrema,NA,Homicídio,NA
