titulo,tipo_principal,tipo_detalhado,gravidade,validado,tipo_corrigido,observacoes
Família procura menina de 11 anos que desapareceu em Manaus,Não classificado com precisão,Requer análise manual,indefinida,NA,Não classificado com precisão,NA
"Famílias de Benício Xavier e Pedro Henrique, crianças mortas por suspeita de erro médico, protestam em Manaus",Não classificado com precisão,Requer análise manual,indefinida,NA,Não classificado com precisão,NA
Favela de Natal agita Manaus com festa de funk e eletrônico na madrugada pós-ceia,Não classificado com precisão,Requer análise manual,indefinida,NA,Não classificado com precisão,NA
Feminicídio: ex-companheiro mata jovem de 20 anos por não aceitar fim do relacionamento,Não classificado com precisão,Requer análise manual,indefinida,NA,Não classificado com precisão,NA
Feriados de 2026 no Amazonas: maioria cai em dias úteis e deve gerar feriadões,Não classificado com precisão,Requer análise manual,indefinida,NA,Não classificado com precisão,NA
"Ferveion 26 terá 8 horas de festa, dois palcos e mais de 10 atrações em Manaus",Não classificado com precisão,Requer análise manual,indefinida,NA,Não classificado com precisão,NA
"FICCO apreende mais de R$ 1,1 milhão em ações contra suspeita de lavagem de dinheiro em Manaus",Não classificado com precisão,Requer análise manual,indefinida,NA,Não classificado com precisão,NA
Filha encontra a mãe morta com golpes de faca no Monte das Oliveiras,Esfaqueamento,Lesão com instrumento cortante,alta,NA,Esfaqueamento,NA
Filho ameaça mãe com faca e acaba preso por policial disfarçado em Manaus,Esfaqueamento,Lesão com instrumento cortante,alta,NA,Esfaqueamento,NA
Filho de ex-vereador de Iranduba morre em atentado; político está em estado grave,Não classificado com precisão,Requer análise manual,indefinida,NA,Não classificado com precisão,NA
Filho é preso após ameaçar matar mãe e ‘beber sangue dela’ no AM,Homicídio,Homicídio consumado,extrema,NA,Homicídio,NA
Filho é preso após invadir casa da mãe com facão e ameaçá-la no AM,Esfaqueamento,Lesão com instrumento cortante,alta,NA,Esfaqueamento,NA
Filho é preso em Manaus por ocultação de cadáver da própria mãe,Não classificado com precisão,Requer análise manual,indefinida,NA,Não classificado com precisão,NA
Filho é preso por extorquir pai idoso para comprar drogas em Manaus,Não classificado com precisão,Requer análise manual,indefinida,NA,Não classificado com precisão,NA
"Filho é preso por matar mãe a facadas após ela negar dinheiro para drogas, em Manaus",Homicídio,Homicídio consumado,extrema,NA,Homicídio,NA
"Filho ignora ordem da Justiça, invade casa da mãe e acaba preso no AM",Não classificado com precisão,Requer análise manual,indefinida,NA,Não classificado com precisão,NA
Filho morde e arranca orelha de pai idoso no AM,Não classificado com precisão,Requer análise manual,indefinida,NA,Não classificado com precisão,NA
Filho planejava realizar empréstimo bancário em nome do pai idoso morto,Homicídio,Homicídio consumado,extrema,NA,Homicídio,NA
"""Filipinho"", ""Ligeiro"" e ""Motora"" são presos por furto de carros com chapolin",Não classificado com precisão,Requer análise manual,indefinida,NA,Não classificado com precisão,NA
Fiscalização encontra adolescentes bebendo e tadalafila à venda em bares de Manaus,Não classificado com precisão,Requer análise manual,indefinida,NA,Não classificado com precisão,NA
Flamengo pode decidir o título do Brasileirão já nesta terça-feira,Não classificado com precisão,Requer análise manual,indefinida,NA,Não classificado com precisão,NA
"""Foi o fim do sofrimento"": mãe desabafa após filho ser morto pelo próprio irmão em Manaus",Homicídio,Homicídio consumado,extrema,NA,Homicídio,NA
Foragida por homicídio do marido é localizada após denúncia por esfaquear cachorro,Homicídio,Homicídio consumado,extrema,NA,Homicídio,NA
Foragido condenado por homicídio e estupro é preso em Itacoatiara,Homicídio,Homicídio consumado,extrema,NA,Homicídio,NA
Foragido da justiça do Pará por homicídio é preso em Manaus,Homicídio,Homicídio consumado,extrema,NA,Homicídio,NA
Foragido da Justiça do Pará por homicídio é preso na Zona Leste de Manaus,Homicídio,Homicídio consumado,extrema,NA,Homicídio,NA
Foragido da Justiça é preso em ação integrada entre Guarda Municipal de Manaus e Polícia Federal,Não classificado com precisão,Requer análise manual,indefinida,NA,Não classificado com precisão,NA
Foragido da Justiça é preso no Porto de Manaus ao tentar deixar o AM,Não classificado com precisão,Requer análise manual,indefinida,NA,Não classificado com precisão,NA
Foragido da Justiça é preso por tráfico de drogas em Fonte Boa,Tráfico de Drogas/Facções,Tráfico associado a facção criminosa,alta,NA,Tráfico de Drogas/Facções,NA
Foragido da Justiça por tráfico de drogas é recapturado na zona leste de Manaus,Tráfico de Drogas/Facções,Tráfico associado a facção criminosa,alta,NA,Tráfico de Drogas/Facções,NA
"Foragido da justiça por tráfico, tortura e roubo é capturado em Uarini",Roubo/Assalto,Roubo/assalto com confronto,alta,NA,Roubo/Assalto,NA
"Foragido da Justiça, 'Talquinho' é recapturado na zona leste de Manaus",Não classificado com precisão,Requer análise manual,indefinida,NA,Não classificado com precisão,NA
"Foragido de alta periculosidade, ‘Dentinho’ é preso no Viver Melhor",Não classificado com precisão,Requer análise manual,indefinida,NA,Não classificado com precisão,NA
Foragido é preso durante patrulhamento da 22ª Cicom,Não classificado com precisão,Requer análise manual,indefinida,NA,Não classificado com precisão,NA
Foragido por estupro de vulnerável é preso em Manaus,Estupro,Estupro consumado,extrema,NA,Estupro,NA
Foragido por homicídio em Santa Catarina é capturado em Manaus,Homicídio,Homicídio consumado,extrema,NA,Homicídio,NA
Foragido por roubo é capturado na Redenção,Roubo/Assalto,Roubo/assalto com confronto,alta,NA,Roubo/Assalto,NA
Foragido por tráfico de drogas é preso no Cidade de Deus,Tráfico de Drogas/Facções,Tráfico associado a facção criminosa,alta,NA,Tráfico de Drogas/Facções,NA
Foragido que matou ex a facadas em Manaus é preso em São Paulo,Homicídio,Homicídio consumado,extrema,NA,Homicídio,NA
Foragido tenta escapar escalando prédio do fórum em Manaus e acaba preso,Não classificado com precisão,Requer análise manual,indefinida,NA,Não classificado com precisão,NA
Foragido tenta usar identidade falsa e é preso por tráfico de drogas no AM,Tráfico de Drogas/Facções,Tráfico associado a facção criminosa,alta,NA,Tráfico de Drogas/Facções,NA
Foragidos da Justiça são capturados em diversas zonas de Manaus no fim de semana,Não classificado com precisão,Requer análise manual,indefinida,NA,Não classificado com precisão,NA
Força Tática apreende 24 tabletes de drogas enterrados em área de mata em Manaus,Não classificado com precisão,Requer análise manual,indefinida,NA,Não classificado com precisão,NA
"Força Tática apreende armas, munições e drogas após denúncia no bairro Compensa",Não classificado com precisão,Requer análise manual,indefinida,NA,Não classificado com precisão,NA
Força Tática apreende mais de 200 kg de drogas em pneu de carreta em Manaus,Não classificado com precisão,Requer análise manual,indefinida,NA,Não classificado com precisão,NA
Força Tática encontra mais de 2 mil munições em mochila abandonada na zona Norte de Manaus,Não classificado com precisão,Requer análise manual,indefinida,NA,Não classificado com precisão,NA
‘Formiga’ é encontrada morta e seminua embaixo de micro-ônibus no AM,Não classificado com precisão,Requer análise manual,indefinida,NA,Não classificado com precisão,NA
Frasco de impermeabilizante é confundido com bomba em entrega de viaturas em Manaus,Não classificado com precisão,Requer análise manual,indefinida,NA,Não classificado com precisão,NA
Fuga de presídio em Maués: veja quem são os detentos foragidos,Não classificado com precisão,Requer análise manual,indefinida,NA,Não classificado com precisão,NA
Fuga de presos em Maués: dois são recapturados e 12 seguem foragidos,Não classificado com precisão,Requer análise manual,indefinida,NA,Não classificado com precisão,NA
Fugitivo da justiça que matou homem por causa de R$ 10 é recapturado no Alvorada II,Homicídio,Homicídio consumado,extrema,NA,Homicídio,NA
Fugitivo há pelo menos três anos pelo crime de assassinato é preso pela ROCAM,Homicídio,Homicídio consumado,extrema,NA,Homicídio,NA
"""Fui possuído pelo demônio"", afirma homem que matou companheira com 46 facadas em Manaus",Homicídio,Homicídio consumado,extrema,NA,Homicídio,NA
Funcionário é preso após furtar latas de leite de mercadinho em Manaus,Não classificado com precisão,Requer análise manual,indefinida,NA,Não classificado com precisão,NA
Funcionário é preso por roubar R$ 25 mil de posto de gasolina em Borba,Não classificado com precisão,Requer análise manual,indefinida,NA,Não classificado com precisão,NA
Funcionários trancam suspeito durante assalto e ajudam na prisão em Manaus,Roubo/Assalto,Roubo/assalto com confronto,alta,NA,Roubo/Assalto,NA
Goleiro do São Raimundo fala sobre defender time do coração,Não classificado com precisão,Requer análise manual,indefinida,NA,Não classificado com precisão,NA
Golpe da ligação muda: criminosos usam sua voz para fraudes no AM; veja como se proteger,Não classificado com precisão,Requer análise manual,indefinida,NA,Não classificado com precisão,NA
Golpe do falso pagamento via Pix cresce e polícia no AM orienta como evitar,Não classificado com precisão,Requer análise manual,indefinida,NA,Não classificado com precisão,NA
Golpe no WhatsApp: criminosos simulam multas e suspensão da CNH no Amazonas,Não classificado com precisão,Requer análise manual,indefinida,NA,Não classificado com precisão,NA
Golpista é preso em Manaus por enganar mulher com falsa compra de carro de leilão,Não classificado com precisão,Requer análise manual,indefinida,NA,Não classificado com precisão,NA
'Gordinho' e 'Katleia' são presos por envolvimento em roubo de R$ 10 mil de comércio na zona Leste,Roubo/Assalto,Roubo/assalto com confronto,alta,NA,Roubo/Assalto,NA
Granada de 40mm é encontrada em área de mata frequentada por traficantes no Tarumã,Não classificado com precisão,Requer análise manual,indefinida,NA,Não classificado com precisão,NA
Grave acidente de trânsito deixa dois feridos e um morto na Zona Leste de Manaus; VÍDEO,Homicídio,Homicídio consumado,extrema,NA,Homicídio,NA
Grávida de 18 anos é morta a tiros dentro de casa,Não classificado com precisão,Requer análise manual,indefinida,NA,Não classificado com precisão,NA
Grávida de 8 meses é espancada pelo companheiro e salva por vizinha em Manaus,Espancamento,Lesão com agressão física grave,alta,NA,Espancamento,NA
"Grávida de sete meses morre após cair de moto em buraco na Djalma Batista, em Manaus",Não classificado com precisão,Requer análise manual,indefinida,NA,Não classificado com precisão,NA
Grávida é morta por estrangulamento na Rocinha; companheiro é preso,Não classificado com precisão,Requer análise manual,indefinida,NA,Não classificado com precisão,NA
Greve Nacional: Petroleiros de Urucu paralisam atividades no Amazonas,Não classificado com precisão,Requer análise manual,indefinida,NA,Não classificado com precisão,NA
Grupo criminoso é alvo de operação da PF por fraudar concursos públicos,Não classificado com precisão,Requer análise manual,indefinida,NA,Não classificado com precisão,NA
Grupo de 10 pistoleiros executa em Manaus conselheiro do Comando Vermelho com 18 tiros,Tráfico de Drogas/Facções,Tráfico associado a facção criminosa,alta,NA,Tráfico de Drogas/Facções,NA
Grupo desarticulado no AM planejava criar o “Cartel 13” para tráfico interestadual de drogas,Tráfico de Drogas/Facções,Tráfico associado a facção criminosa,alta,NA,Tráfico de Drogas/Facções,NA
"Grupo é detido por furto de celulares nas proximidades do Bumbódromo, em Parintins",Não classificado com precisão,Requer análise manual,indefinida,NA,Não classificado com precisão,NA
Grupo é preso por sequestro e extorsão de casal em Manaus,Sequestro/Cárcere Privado,Privação de liberdade com restrição,muito alta,NA,Sequestro/Cárcere Privado,NA
Grupo é procurados por roubos a ônibus do transporte coletivo em Manaus,Roubo/Assalto,Roubo/assalto com confronto,alta,NA,Roubo/Assalto,NA
Grupo invade casa e executa homem a tiros em Manaus; criança de sete anos foi baleada,Não classificado com precisão,Requer análise manual,indefinida,NA,Não classificado com precisão,NA
Guarda municipal é preso no AM por estupro de vulnerável e exploração de enteada de 13 anos,Estupro,Estupro consumado,extrema,NA,Estupro,NA
"'Guerra' entre facções criminosas motivou quatro mortes em Coari, segundo a Polícia Militar",Homicídio,Homicídio consumado,extrema,NA,Homicídio,NA
Guia turístico é preso por importunação sexual contra 3 mulheres e criança em Manaus,Não classificado com precisão,Requer análise manual,indefinida,NA,Não classificado com precisão,NA
Haitiano procurado pela Interpol é preso ao desembarcar em Manaus,Não classificado com precisão,Requer análise manual,indefinida,NA,Não classificado com precisão,NA
Helicóptero faz resgate de criança e idosa,Não classificado com precisão,Requer análise manual,indefinida,NA,Não classificado com precisão,NA
Hemoam registra queda de 40% nas doações de sangue às vésperas do Natal; confira horário de atendimento,Não classificado com precisão,Requer análise manual,indefinida,NA,Não classificado com precisão,NA
Homem acusado de matar mulher é condenado a 18 anos de prisão,Homicídio,Homicídio consumado,extrema,NA,Homicídio,NA
"Homem agride a companheira durante discussão e acaba levando facada no peito, na zona Leste",Esfaqueamento,Lesão com instrumento cortante,alta,NA,Esfaqueamento,NA
"Homem agride companheira com socos, mordidas e puxões de cabelo em rua no AM",Não classificado com precisão,Requer análise manual,indefinida,NA,Não classificado com precisão,NA
Homem ameaça crianças com pedras e terçado após se irritar com barulho em Manaus,Não classificado com precisão,Requer análise manual,indefinida,NA,Não classificado com precisão,NA
Homem ameaça própria mãe com facão e é preso no interior do Amazonas,Esfaqueamento,Lesão com instrumento cortante,alta,NA,Esfaqueamento,NA
Homem apontado como líder do tráfico de drogas é preso em Novo Airão,Tráfico de Drogas/Facções,Tráfico associado a facção criminosa,alta,NA,Tráfico de Drogas/Facções,NA
Homem ataca morador de rua com tijoladas e acaba preso no interior do AM,Não classificado com precisão,Requer análise manual,indefinida,NA,Não classificado com precisão,NA
Homem atira acidentalmente contra amigo durante caça em região de mata em Manaus,Não classificado com precisão,Requer análise manual,indefinida,NA,Não classificado com precisão,NA
Homem baleado dentro do shopping Ponta Negra morre no SPA da Compensa,Não classificado com precisão,Requer análise manual,indefinida,NA,Não classificado com precisão,NA
Homem com diversos BOs por descumprimento de medida protetiva é capturado pela polícia,Não classificado com precisão,Requer análise manual,indefinida,NA,Não classificado com precisão,NA
Homem com mais de 10 passagens por furto é preso curtindo música em som roubado em motel de Manaus,Não classificado com precisão,Requer análise manual,indefinida,NA,Não classificado com precisão,NA
Homem com mandado de prisão por roubo tenta enganar a polícia com nome falso,Roubo/Assalto,Roubo/assalto com confronto,alta,NA,Roubo/Assalto,NA
Homem com mandado por violência doméstica é preso no Parque 10,Não classificado com precisão,Requer análise manual,indefinida,NA,Não classificado com precisão,NA
"Homem com passagens por homicídios é executado com 11 tiros na Compensa, Manaus",Homicídio,Homicídio consumado,extrema,NA,Homicídio,NA
Homem com tornozeleira é executado a tiros na frente de tabacaria no Dom Pedro,Homicídio,Homicídio consumado,extrema,NA,Homicídio,NA
Homem condenado a oito anos de prisão por estupro de vulnerável é capturado no interior,Estupro,Estupro consumado,extrema,NA,Estupro,NA
Homem condenado por estupro é preso em Barreirinha,Estupro,Estupro consumado,extrema,NA,Estupro,NA
Homem condenado por roubos no interior é preso na Zona Oeste de Manaus,Roubo/Assalto,Roubo/assalto com confronto,alta,NA,Roubo/Assalto,NA
Homem condenado por tráfico de drogas é preso em Beruri,Tráfico de Drogas/Facções,Tráfico associado a facção criminosa,alta,NA,Tráfico de Drogas/Facções,NA
Homem conhecido como ‘China’ é encontrado morto na Zona Norte de Manaus,Homicídio,Homicídio consumado,extrema,NA,Homicídio,NA
Homem conhecido como ‘Maranhão’ é encontrado morto no Centro de Manaus,Homicídio,Homicídio consumado,extrema,NA,Homicídio,NA
"Homem conhecido como ""Pato"" é morto a tiros durante a madrugada em Borba",Homicídio,Homicídio consumado,extrema,NA,Homicídio,NA
"Homem de 19 anos é preso por agredir e ameaçar a própria mãe, que está com câncer",Não classificado com precisão,Requer análise manual,indefinida,NA,Não classificado com precisão,NA
Homem de 23 anos é preso em flagrante por estuprar a enteada na zona leste de Manaus,Não classificado com precisão,Requer análise manual,indefinida,NA,Não classificado com precisão,NA
Homem de 29 anos é preso por estuprar mulher em casa abandonada,Não classificado com precisão,Requer análise manual,indefinida,NA,Não classificado com precisão,NA
Homem de 41 anos é preso suspeito de estupro contra a própria sobrinha em Manacapuru,Estupro,Estupro consumado,extrema,NA,Estupro,NA
Homem de 46 anos é preso por estupro de ex-enteada aos 14 anos,Estupro,Estupro consumado,extrema,NA,Estupro,NA
"Homem de 48 anos é preso por torturar, dopar e estuprar filha e neta em Manaus",Não classificado com precisão,Requer análise manual,indefinida,NA,Não classificado com precisão,NA
Homem de 58 anos é preso por estupro da própria filha de 14 anos,Estupro de Vulnerável,Estupro de criança/adolescente,extrema,NA,Estupro de Vulnerável,NA
Homem de 59 anos é preso no interior do AM por estuprar bisneta de sua companheira,Não classificado com precisão,Requer análise manual,indefinida,NA,Não classificado com precisão,NA
Homem desaparece após sair de casa na Zona Sul de Manaus,Não classificado com precisão,Requer análise manual,indefinida,NA,Não classificado com precisão,NA
Homem é agredido por moradores do bairro Petrópolis e socorrido pelo Samu,Não classificado com precisão,Requer análise manual,indefinida,NA,Não classificado com precisão,NA
"Homem é assassinado com 11 tiros no bairro São José, em Manaus",Homicídio,Homicídio consumado,extrema,NA,Homicídio,NA
Homem é assassinado na garagem de casa,Homicídio,Homicídio consumado,extrema,NA,Homicídio,NA
"Homem é baleado, agredido e abandonado pelo comparsa após assaltar mercadinho em Manaus",Não classificado com precisão,Requer análise manual,indefinida,NA,Não classificado com precisão,NA
Homem é baleado dentro de shopping na zona Oeste de Manaus,Não classificado com precisão,Requer análise manual,indefinida,NA,Não classificado com precisão,NA
Homem é condenado a 12 anos por morte de vendedor ambulante em Manaus,Homicídio,Homicídio consumado,extrema,NA,Homicídio,NA
Homem é condenado a 15 anos por matar conhecido a facadas em Manaus,Homicídio,Homicídio consumado,extrema,NA,Homicídio,NA
Homem é condenado a 18 anos de prisão pela morte de enteado com TEA,Homicídio,Homicídio consumado,extrema,NA,Homicídio,NA
Homem é condenado a 22 anos por tentar matar ex atropelada em Manaus,Homicídio,Homicídio consumado,extrema,NA,Homicídio,NA
Homem é condenado a 97 anos de prisão por incêndio em casa lotérica no centro de Manaus,Não classificado com precisão,Requer análise manual,indefinida,NA,Não classificado com precisão,NA
Homem é denunciado por viver como casal com criança e criar ciclo de violência no AM,Não classificado com precisão,Requer análise manual,indefinida,NA,Não classificado com precisão,NA
Homem é detido por ameaçar e tentar agredir companheira em Manaus,Agressão Doméstica,Violência doméstica com lesão corporal,alta,NA,Agressão Doméstica,NA
Homem é detido por circular com pai morto em cadeira de rodas no Centro,Homicídio,Homicídio consumado,extrema,NA,Homicídio,NA
"Homem é encontrado boiando em praia de Maués, no Amazonas",Não classificado com precisão,Requer análise manual,indefinida,NA,Não classificado com precisão,NA
"Homem é encontrado morto com escoriações na Praça 14, em Manaus",Homicídio,Homicídio consumado,extrema,NA,Homicídio,NA
Homem é encontrado morto com golpes na cabeça no Centro de Manaus,Homicídio,Homicídio consumado,extrema,NA,Homicídio,NA
Homem é encontrado morto com marcas de espancamento na Ponta Negra,Homicídio,Homicídio consumado,extrema,NA,Homicídio,NA
Homem é encontrado morto com sinais de execução na zona norte de Manaus,Homicídio,Homicídio consumado,extrema,NA,Homicídio,NA
Homem é encontrado morto em estacionamento próximo ao Porto de Manaus,Homicídio,Homicídio consumado,extrema,NA,Homicídio,NA
Homem é encontrado morto na Avenida dos Oitis e polícia apura possível acidente de trânsito,Homicídio,Homicídio consumado,extrema,NA,Homicídio,NA
Homem é esfaqueado e tem pernas quebradas por grupo criminoso,Esfaqueamento,Lesão com instrumento cortante,alta,NA,Esfaqueamento,NA
Homem é espancado até a morte e encontrado em terreno baldio no Novo Aleixo,Homicídio,Homicídio consumado,extrema,NA,Homicídio,NA
Homem é executado a tiros dentro de casa na zona Norte de Manaus,Homicídio,Homicídio consumado,extrema,NA,Homicídio,NA
Homem é executado com mais de 10 tiros e corpo é encontrado na Colônia Terra Nova,Homicídio,Homicídio consumado,extrema,NA,Homicídio,NA
"Homem é executado com tiros na cabeça em Itacoatiara, no AM",Homicídio,Homicídio consumado,extrema,NA,Homicídio,NA
Homem é executado dentro de casa e criança fica ferida na Zona Oeste de Manaus,Homicídio,Homicídio consumado,extrema,NA,Homicídio,NA
Homem é executado dentro de casa na Compensa,Homicídio,Homicídio consumado,extrema,NA,Homicídio,NA
Homem é flagrado com fábrica clandestina de munições no AM,Não classificado com precisão,Requer análise manual,indefinida,NA,Não classificado com precisão,NA
Homem é linchado até a morte no bairro Japiim; suspeitos fugiram,Homicídio,Homicídio consumado,extrema,NA,Homicídio,NA
Homem é morto a facadas após briga com primo em Manaus,Homicídio,Homicídio consumado,extrema,NA,Homicídio,NA
Homem é morto a tiros após levar documento a endereço na Zona Norte de Manaus,Homicídio,Homicídio consumado,extrema,NA,Homicídio,NA
Homem é morto a tiros em Manacapuru; polícia investiga crime ligado a furtos e drogas,Homicídio,Homicídio consumado,extrema,NA,Homicídio,NA
Homem é morto a tiros em rua do bairro Planalto,Homicídio,Homicídio consumado,extrema,NA,Homicídio,NA
Homem é morto a tiros no bairro Lírio do Vale,Homicídio,Homicídio consumado,extrema,NA,Homicídio,NA
"Homem é morto a tiros no Riacho Doce, em Manaus",Homicídio,Homicídio consumado,extrema,NA,Homicídio,NA
Homem é morto com facada no pescoço em beco na zona Leste de Manaus,Homicídio,Homicídio consumado,extrema,NA,Homicídio,NA
Homem é morto com golpes de canivete no Manoa,Homicídio,Homicídio consumado,extrema,NA,Homicídio,NA
Homem é morto e criança de seis anos é baleada em Manaus,Homicídio,Homicídio consumado,extrema,NA,Homicídio,NA
Homem é morto pelo enteado durante a ceia de Natal na frente da filha autista,Homicídio,Homicídio consumado,extrema,NA,Homicídio,NA
Homem é perseguido e morto a tiros em rua de Iranduba,Homicídio,Homicídio consumado,extrema,NA,Homicídio,NA
Homem é preso acusado de torturar e causar a morte da própria esposa em Manaus,Homicídio,Homicídio consumado,extrema,NA,Homicídio,NA
Homem é preso ao pedir medida protetiva após tentar matar companheira no AM,Homicídio,Homicídio consumado,extrema,NA,Homicídio,NA
Homem é preso ao ser flagrado com submetralhadora falsa na zona Leste de Manaus,Não classificado com precisão,Requer análise manual,indefinida,NA,Não classificado com precisão,NA
Homem é preso ao tentar furtar produtos de farmácia na zona Centro-Sul de Manaus,Não classificado com precisão,Requer análise manual,indefinida,NA,Não classificado com precisão,NA
Homem é preso ao usar cartão de PM para compras em Manaus,Não classificado com precisão,Requer análise manual,indefinida,NA,Não classificado com precisão,NA
Homem é preso após agredir companheira por ciúmes no Amazonas,Agressão Doméstica,Violência doméstica com lesão corporal,alta,NA,Agressão Doméstica,NA
Homem é preso após agredir ex-companheira usando fio de ar-condicionado no bairro Alvorada,Agressão Doméstica,Violência doméstica com lesão corporal,alta,NA,Agressão Doméstica,NA
Homem é preso após agredir ex-mulher e pai dela em Manaus,Agressão Doméstica,Violência doméstica com lesão corporal,alta,NA,Agressão Doméstica,NA
Homem é preso após agredir mãe de 72 anos com socos no rosto em Manaus,Não classificado com precisão,Requer análise manual,indefinida,NA,Não classificado com precisão,NA
Homem é preso após arrombar casa e tentar matar ex-mulher com terçado no AM,Homicídio,Homicídio consumado,extrema,NA,Homicídio,NA
