titulo,tipo_principal,tipo_detalhado,gravidade,validado,tipo_corrigido,observacoes
Polícia divulga foto de homem suspeito de séries de furtos na zona centro-sul de Manaus,Não classificado com precisão,Requer análise manual,indefinida,NA,Não classificado com precisão,NA
Blogueiro condenado a mais de 15 anos de prisão por estupro e roubo é preso em Manaus,Estupro,Estupro consumado,extrema,NA,Estupro,NA
Ciúme motivou o assassinato de homem em Manaus; autor e mandante foram presos,Homicídio,Homicídio consumado,extrema,NA,Homicídio,NA
Vizinho invade casa de adolescente enquanto ela dormia e a estupra no interior do AM,Não classificado com precisão,Requer análise manual,indefinida,NA,Não classificado com precisão,NA
Polícia Civil divulga imagem de homem que desapareceu durante viagem de Porto Velho a Manaus,Não classificado com precisão,Requer análise manual,indefinida,NA,Não classificado com precisão,NA
Técnico de enfermagem preso por importunação sexual em hospital infantil será processado,Não classificado com precisão,Requer análise manual,indefinida,NA,Não classificado com precisão,NA
Homem é executado com mais de 10 tiros e corpo é encontrado na Colônia Terra Nova,Homicídio,Homicídio consumado,extrema,NA,Homicídio,NA
"PC-AM e PMAM prendem três homens por organização criminosa, em Parintins",Não classificado com precisão,Requer análise manual,indefinida,NA,Não classificado com precisão,NA
Enfermeiro é preso por importunação sexual contra adolescente em hospital infantil de Manaus,Não classificado com precisão,Requer análise manual,indefinida,NA,Não classificado com precisão,NA
Polícia investiga execução de empresário colombiano em Rio Preto da Eva,Homicídio,Homicídio consumado,extrema,NA,Homicídio,NA
Sacola com droga avaliada em R$ 100 mil é encontrada em balsa no roadway,Não classificado com precisão,Requer análise manual,indefinida,NA,Não classificado com precisão,NA
Mulher é resgatada de cárcere privado pelo marido em quitinete na zona sul,Sequestro/Cárcere Privado,Privação de liberdade com restrição,muito alta,NA,Sequestro/Cárcere Privado,NA
Polícia divulga imagem de homem procurado por diversos crimes em Manaus,Não classificado com precisão,Requer análise manual,indefinida,NA,Não classificado com precisão,NA
‘Messi’ é preso em flagrante vendendo drogas na zona leste de Manaus,Não classificado com precisão,Requer análise manual,indefinida,NA,Não classificado com precisão,NA
Duplo homicídio: homens são executados em sorveteria na Compensa,Homicídio,Homicídio consumado,extrema,NA,Homicídio,NA
"Após tiroteio, jovem de 23 anos é assassinado no Jorge Teixeira",Homicídio,Homicídio consumado,extrema,NA,Homicídio,NA
Jovem é morto a tiros ao estacionar carro com a companheira na zona Sul de Manaus,Homicídio,Homicídio consumado,extrema,NA,Homicídio,NA
Homem é morto com facada no pescoço em beco na zona Leste de Manaus,Homicídio,Homicídio consumado,extrema,NA,Homicídio,NA
"Em Coari, PC-AM prende 25 pessoas ligadas ao crime organizado e por financiar pirataria no rio",Não classificado com precisão,Requer análise manual,indefinida,NA,Não classificado com precisão,NA
"Mulher usa whatsapp para denunciar agressões sofridas por seu companheiro, que acaba preso em Manaus",Não classificado com precisão,Requer análise manual,indefinida,NA,Não classificado com precisão,NA
Assaltantes renderam funcionária e fugiram de moto após assalto a joalheria,Roubo/Assalto,Roubo/assalto com confronto,alta,NA,Roubo/Assalto,NA
Polícia é acionada após roubo a joalheria em shopping de Manaus,Roubo/Assalto,Roubo/assalto com confronto,alta,NA,Roubo/Assalto,NA
Operação Abismo: homem é preso por estupro e tráfico de drogas em Manacapuru,Estupro,Estupro consumado,extrema,NA,Estupro,NA
Polícia prende homem por tentativa de estupro e lesão corporal contra idosa no interior do AM,Estupro,Estupro consumado,extrema,NA,Estupro,NA
Polícia divulga imagem de homem procurado por agredir a ex-companheira,Agressão Doméstica,Violência doméstica com lesão corporal,alta,NA,Agressão Doméstica,NA
Bebê é encontrada morta e com lesões no corpo na zona leste de Manaus,Não classificado com precisão,Requer análise manual,indefinida,NA,Não classificado com precisão,NA
'Piratas de Rio' trocam tiros com a PM no Solimões; um morre e outro é preso,Não classificado com precisão,Requer análise manual,indefinida,NA,Não classificado com precisão,NA
Polícia Civil prende homem por roubo a pastelaria no bairro Flores,Roubo/Assalto,Roubo/assalto com confronto,alta,NA,Roubo/Assalto,NA
Crise de oxigênio: justiça manda governos acolherem vítimas quatro anos depois,Não classificado com precisão,Requer análise manual,indefinida,NA,Não classificado com precisão,NA
Três mulheres são presas após tentativa de homicídio em adega de Manaus,Homicídio,Homicídio consumado,extrema,NA,Homicídio,NA
Suspeito de matar ex-mulher e namorado dela se entrega à polícia,Homicídio,Homicídio consumado,extrema,NA,Homicídio,NA
Ex-padastro é preso suspeito de perseguição e estupro de vulnerável contra a ex-enteada,Estupro,Estupro consumado,extrema,NA,Estupro,NA
"Carro perde controle, sobe canteiro, derruba poste e trava trânsito na avenida Maceió",Não classificado com precisão,Requer análise manual,indefinida,NA,Não classificado com precisão,NA
Homem é preso por matar morador em situação de rua a pauladas na Cidade Nova,Homicídio,Homicídio consumado,extrema,NA,Homicídio,NA
PF deflagra operação para combater crimes eleitorais no Amazonas,Não classificado com precisão,Requer análise manual,indefinida,NA,Não classificado com precisão,NA
Polícia intercepta táxi e prende dupla de traficantes com droga avaliada em R$ 160 mil na BR-317,Não classificado com precisão,Requer análise manual,indefinida,NA,Não classificado com precisão,NA
Polícia desmonta bando suspeito de série de assaltos em Manaus,Roubo/Assalto,Roubo/assalto com confronto,alta,NA,Roubo/Assalto,NA
Jovem de 22 anos é assassinado a facadas no Jorge Teixeira II,Homicídio,Homicídio consumado,extrema,NA,Homicídio,NA
Polícia prende vizinho e padrasto por estupro de vulnerável cometido contra criança de 10 anos,Estupro de Vulnerável,Estupro de criança/adolescente,extrema,NA,Estupro de Vulnerável,NA
"Em Atalaia do Norte, Polícia prende homem por estupro de vulnerável e agressão contra a enteada",Estupro,Estupro consumado,extrema,NA,Estupro,NA
Polícia apreende 33 tabletes de maconha do tipo skunk e pasta base de cocaína em Fonte Boa,Não classificado com precisão,Requer análise manual,indefinida,NA,Não classificado com precisão,NA
Dupla é presa com arma e moto roubada no bairro Zumbi dos Palmares,Não classificado com precisão,Requer análise manual,indefinida,NA,Não classificado com precisão,NA
Professor de jiu-jitsu é preso em Humaitá acusado de estupro e importunação sexual contra alunos,Estupro,Estupro consumado,extrema,NA,Estupro,NA
"Em Atalaia do Norte, homem é preso por estupro e agressão contra enteada de 15 anos",Estupro,Estupro consumado,extrema,NA,Estupro,NA
"""Foi o fim do sofrimento"": mãe desabafa após filho ser morto pelo próprio irmão em Manaus",Homicídio,Homicídio consumado,extrema,NA,Homicídio,NA
Motorista é detido por adulterar placa de moto com fita adesiva em Manaus,Não classificado com precisão,Requer análise manual,indefinida,NA,Não classificado com precisão,NA
"Em Manaus, traficante internacional é preso com cápsulas de droga e arma de uso restrito",Não classificado com precisão,Requer análise manual,indefinida,NA,Não classificado com precisão,NA
Taxista é assassinado a tiros na AM-010 durante a madrugada,Homicídio,Homicídio consumado,extrema,NA,Homicídio,NA
Homem é condenado a 97 anos de prisão por incêndio em casa lotérica no centro de Manaus,Não classificado com precisão,Requer análise manual,indefinida,NA,Não classificado com precisão,NA
"Em São Gabriel da Cachoeira, PC-AM prende homem investigado por tortura contra enteada",Não classificado com precisão,Requer análise manual,indefinida,NA,Não classificado com precisão,NA
Jovem é executado a tiros dentro de apartamento na zona Sul de Manaus,Homicídio,Homicídio consumado,extrema,NA,Homicídio,NA
"Em São Paulo de Olivença, PC-AM prende homem por estupro de vulnerável contra uma adolescente",Estupro de Vulnerável,Estupro de criança/adolescente,extrema,NA,Estupro de Vulnerável,NA
"PC-AM prende homem por agressão, injúria, ameaça e dano qualificado contra seu pai idoso",Não classificado com precisão,Requer análise manual,indefinida,NA,Não classificado com precisão,NA
"Dois homens são presos por agredirem as companheiras, em Manaus",Agressão Doméstica,Violência doméstica com lesão corporal,alta,NA,Agressão Doméstica,NA
"Em Barcelos, Polícia prende dois homens e uma mulher por tráfico de drogas e receptação",Tráfico de Drogas/Facções,Tráfico associado a facção criminosa,alta,NA,Tráfico de Drogas/Facções,NA
Homem é preso em Santo Antônio do Içá por estupro virtual de jovem no Rio de Janeiro,Estupro,Estupro consumado,extrema,NA,Estupro,NA
Foragido tenta escapar escalando prédio do fórum em Manaus e acaba preso,Não classificado com precisão,Requer análise manual,indefinida,NA,Não classificado com precisão,NA
"""Cara de gato"" é preso após atirar em família durante culto em igreja",Não classificado com precisão,Requer análise manual,indefinida,NA,Não classificado com precisão,NA
Família identifica corpo de homem encontrado esquartejado no Jorge Teixeira,Não classificado com precisão,Requer análise manual,indefinida,NA,Não classificado com precisão,NA
Violência Doméstica: homem é preso após agredir esposa e morder o filho em Manaus,Agressão Doméstica,Violência doméstica com lesão corporal,alta,NA,Agressão Doméstica,NA
Polícia desarticula laboratório de droga na zona norte de Manaus; traficantes fugiram do local,Não classificado com precisão,Requer análise manual,indefinida,NA,Não classificado com precisão,NA
Sine Amazonas divulga 354 vagas de emprego para esta terça-feira,Não classificado com precisão,Requer análise manual,indefinida,NA,Não classificado com precisão,NA
Homem esquartejado é achado em sacolas na zona Leste de Manaus,Não classificado com precisão,Requer análise manual,indefinida,NA,Não classificado com precisão,NA
"Em Borba, PC-AM prende homem e apreende menor por abusar sexualmente de adolescente",Não classificado com precisão,Requer análise manual,indefinida,NA,Não classificado com precisão,NA
"PC-AM divulga imagem de procurado por tentativa de estupro e lesão corporal contra idosa, em Uarini",Estupro,Estupro consumado,extrema,NA,Estupro,NA
"Polícia procura por homem suspeito de tráfico de drogas e associação para o tráfico, em Borba",Tráfico de Drogas/Facções,Tráfico associado a facção criminosa,alta,NA,Tráfico de Drogas/Facções,NA
Homem é preso suspeito de esfaquear pessoa pelas costas em Fonte Boa,Não classificado com precisão,Requer análise manual,indefinida,NA,Não classificado com precisão,NA
"Trio é preso ao tentar arremessar drogas, bebidas e celulares para dentro de presídio em Coari",Não classificado com precisão,Requer análise manual,indefinida,NA,Não classificado com precisão,NA
Ex-marido é suspeito de duplo homícidio cometido na frente dos filhos da ex-companheira,Homicídio,Homicídio consumado,extrema,NA,Homicídio,NA
População amarra e espanca homem suspeito de roubos no bairro Vila da Prata,Roubo/Assalto,Roubo/assalto com confronto,alta,NA,Roubo/Assalto,NA
Casal é morto a tiros no Novo Aleixo; suspeito fugiu,Homicídio,Homicídio consumado,extrema,NA,Homicídio,NA
Homem é preso por estupro durante fiscalização na zona Leste,Estupro,Estupro consumado,extrema,NA,Estupro,NA
Filho planejava realizar empréstimo bancário em nome do pai idoso morto,Homicídio,Homicídio consumado,extrema,NA,Homicídio,NA
Homem é detido por circular com pai morto em cadeira de rodas no Centro,Homicídio,Homicídio consumado,extrema,NA,Homicídio,NA
Homem é preso no Jorge Teixeira por agredir a companheira e a mãe,Agressão Doméstica,Violência doméstica com lesão corporal,alta,NA,Agressão Doméstica,NA
"PC-AM prende homem por injúria, ameaça e perseguição contra a ex-companheira",Não classificado com precisão,Requer análise manual,indefinida,NA,Não classificado com precisão,NA
Polícia prende homem que agrediu e injuriou a ex-companheira grávida,Agressão Doméstica,Violência doméstica com lesão corporal,alta,NA,Agressão Doméstica,NA
"Polícia prende homem que agrediu fisicamente e ameaçou a companheira, na zona Leste de Manaus",Agressão Doméstica,Violência doméstica com lesão corporal,alta,NA,Agressão Doméstica,NA
Dupla é presa ao ser flagrada com pasta base de cocaína e maconha em Maraã,Não classificado com precisão,Requer análise manual,indefinida,NA,Não classificado com precisão,NA
Corpo de idoso é encontrado em área de mata no porto São Raimundo na zona Oeste,Não classificado com precisão,Requer análise manual,indefinida,NA,Não classificado com precisão,NA
Traficante fugitivo da polícia é capturado na zona leste de Manaus,Não classificado com precisão,Requer análise manual,indefinida,NA,Não classificado com precisão,NA
Barbeiro é preso por estuprar enteado de 7 anos após a morte da mãe da criança,Homicídio,Homicídio consumado,extrema,NA,Homicídio,NA
Polícia prende mulher por tráfico em banca de camelô no Centro,Tráfico de Drogas/Facções,Tráfico associado a facção criminosa,alta,NA,Tráfico de Drogas/Facções,NA
Polícia Civil prende homem condenado a 15 anos de reclusão por estupro de vulnerável,Estupro,Estupro consumado,extrema,NA,Estupro,NA
"Em São Gabriel da Cachoeira, homem é preso por violência doméstica e posse irregular de arma de fogo",Não classificado com precisão,Requer análise manual,indefinida,NA,Não classificado com precisão,NA
"Em Parintins, homem é preso suspeito de estuprar menina de 12 anos",Não classificado com precisão,Requer análise manual,indefinida,NA,Não classificado com precisão,NA
Homem é preso suspeito de participação em furto de loja no Centro de Manaus,Não classificado com precisão,Requer análise manual,indefinida,NA,Não classificado com precisão,NA
"Suspeito de tentativa de feminicídio, ameaça e injúria é preso em Manaus",Não classificado com precisão,Requer análise manual,indefinida,NA,Não classificado com precisão,NA
Traficante foge da polícia e abandona na rua uma bolsa com droga e outros itens,Não classificado com precisão,Requer análise manual,indefinida,NA,Não classificado com precisão,NA
'Programa' termina em roubo: casal é preso com drogas e arma falsa,Roubo à Mão Armada,Roubo com uso de arma de fogo,muito alta,NA,Roubo à Mão Armada,NA
"Após briga, homem é assassinato com pedaço de madeira em rua da Cidade Nova",Homicídio,Homicídio consumado,extrema,NA,Homicídio,NA
Execução: homem é encontrado morto com marcas de tiros na cabeça na zona norte de Manaus,Homicídio,Homicídio consumado,extrema,NA,Homicídio,NA
Homem é preso por violação de domicílio e violência doméstica em Santa Isabel do Rio Negro,Não classificado com precisão,Requer análise manual,indefinida,NA,Não classificado com precisão,NA
Polícia Civil desarticula grupo suspeito de roubo de celulares em Manaus,Roubo/Assalto,Roubo/assalto com confronto,alta,NA,Roubo/Assalto,NA
Polícia prende homem com pasta base de cocaína em São Paulo de Olivença,Não classificado com precisão,Requer análise manual,indefinida,NA,Não classificado com precisão,NA
"Em Manaus, Polícia Civil prende foragido do Acre por lesão corporal contra a companheira",Não classificado com precisão,Requer análise manual,indefinida,NA,Não classificado com precisão,NA
Homem é procurado por aplicar golpes e causar prejuízo de R$ 200 mil,Não classificado com precisão,Requer análise manual,indefinida,NA,Não classificado com precisão,NA
Homem morre após explosão de draga utilizada em garimpo ilegal,Não classificado com precisão,Requer análise manual,indefinida,NA,Não classificado com precisão,NA
Corpo é encontrado boiando em igarapé no Centro de Manaus,Não classificado com precisão,Requer análise manual,indefinida,NA,Não classificado com precisão,NA
Corpo de homem é encontrado boiando em igarapé no Centro de Manaus,Não classificado com precisão,Requer análise manual,indefinida,NA,Não classificado com precisão,NA
"Polícia prende homem por estupro, sequestro e cárcere privado em São Gabriel da Cachoeira",Estupro,Estupro consumado,extrema,NA,Estupro,NA
"Em São Gabriel da Cachoeira, homem é preso por lesão corporal contra companheira",Não classificado com precisão,Requer análise manual,indefinida,NA,Não classificado com precisão,NA
"Após denúncia anônima, polícia localiza casa na zona Leste usada para embalar drogas",Não classificado com precisão,Requer análise manual,indefinida,NA,Não classificado com precisão,NA
Homem é preso em flagrante com arma de fogo e munições no Parque São Pedro,Não classificado com precisão,Requer análise manual,indefinida,NA,Não classificado com precisão,NA
Granada de 40mm é encontrada em área de mata frequentada por traficantes no Tarumã,Não classificado com precisão,Requer análise manual,indefinida,NA,Não classificado com precisão,NA
Avô que estuprava as netas é preso; uma era drogada antes dos abusos sexuais,Não classificado com precisão,Requer análise manual,indefinida,NA,Não classificado com precisão,NA
Operação Lousa Negra desarticula quadrilha que aplicava golpes em professores da rede pública,Não classificado com precisão,Requer análise manual,indefinida,NA,Não classificado com precisão,NA
Polícia prende homem que assassinou MC Thiago Braga,Homicídio,Homicídio consumado,extrema,NA,Homicídio,NA
"Homem de 19 anos é preso por agredir e ameaçar a própria mãe, que está com câncer",Não classificado com precisão,Requer análise manual,indefinida,NA,Não classificado com precisão,NA
Tentativa de homicídio em escola: professor que atacou diretor vai passar por audiência de custódia,Homicídio,Homicídio consumado,extrema,NA,Homicídio,NA
Polícia deflaga operação e desarticula organizações criminosas ligadas ao tráfico de drogas em Borba,Tráfico de Drogas/Facções,Tráfico associado a facção criminosa,alta,NA,Tráfico de Drogas/Facções,NA
Justiça do Rio de Janeiro revoga prisão do MC Poze do Rodo,Não classificado com precisão,Requer análise manual,indefinida,NA,Não classificado com precisão,NA
Professor é preso após tentar matar gestor de escola em comunidade de Manacapuru,Homicídio,Homicídio consumado,extrema,NA,Homicídio,NA
Foragido da Justiça do Pará por homicídio é preso na Zona Leste de Manaus,Homicídio,Homicídio consumado,extrema,NA,Homicídio,NA
Mulheres são presas ao tentarem embarcar em voo levando drogas no corpo,Não classificado com precisão,Requer análise manual,indefinida,NA,Não classificado com precisão,NA
Presidente da Câmara de Santa Izabel do Rio Negro é preso suspeito de torturar enteado,Não classificado com precisão,Requer análise manual,indefinida,NA,Não classificado com precisão,NA
Prefeito diz que assalto à UBS em construção foi motivado por políticos,Roubo/Assalto,Roubo/assalto com confronto,alta,NA,Roubo/Assalto,NA
Dois homens são presos por ameaçarem suas esposas; os dois crimes aconteceram na Compensa,Não classificado com precisão,Requer análise manual,indefinida,NA,Não classificado com precisão,NA
Polícia apreende três toneladas de drogas em Manacapuru; dois traficantes morreram,Não classificado com precisão,Requer análise manual,indefinida,NA,Não classificado com precisão,NA
Polícia Civil divulga imagem de seis pessoas procuradas por tráfico de drogas em Borba,Tráfico de Drogas/Facções,Tráfico associado a facção criminosa,alta,NA,Tráfico de Drogas/Facções,NA
"Em São Gabriel da Cachoeira, mulher é presa por desacato e abandono de incapaz",Não classificado com precisão,Requer análise manual,indefinida,NA,Não classificado com precisão,NA
"Homem é preso por tentativa de feminicídio, homicídio e violência doméstica contra esposa e filhos",Feminicídio,Homicídio com contexto doméstico/familiar,extrema,NA,Feminicídio,NA
Corpo de homem é encontrado em igarapé do Educandos com marcas de tortura,Não classificado com precisão,Requer análise manual,indefinida,NA,Não classificado com precisão,NA
Homem é preso por tentativa de feminicídio e abuso contra filhos em Envira,Não classificado com precisão,Requer análise manual,indefinida,NA,Não classificado com precisão,NA
Tragédia na AM-010: acidente entre ônibus e caminhão deixa feridos em Itacoatiara,Não classificado com precisão,Requer análise manual,indefinida,NA,Não classificado com precisão,NA
Homem é preso e adolescente apreendido por tráfico de drogas na zona Oeste de Manaus,Tráfico de Drogas/Facções,Tráfico associado a facção criminosa,alta,NA,Tráfico de Drogas/Facções,NA
Mulher é presa com arsenal em mala durante viagem pelo interior do AM,Não classificado com precisão,Requer análise manual,indefinida,NA,Não classificado com precisão,NA
Homem é preso pela PC-AM por ameaçar e perseguir a mãe idosa,Não classificado com precisão,Requer análise manual,indefinida,NA,Não classificado com precisão,NA
Polícia Civil prende mandante da morte de advogado e servidor do TCE-AM,Homicídio,Homicídio consumado,extrema,NA,Homicídio,NA
"Criminosos invadem casa e matam dois homens no bairro Santo Agostinho, em Manaus",Não classificado com precisão,Requer análise manual,indefinida,NA,Não classificado com precisão,NA
Trio é preso com 62 celulares roubados e réplica de arma na zona Oeste de Manaus,Não classificado com precisão,Requer análise manual,indefinida,NA,Não classificado com precisão,NA
Homem suspeito de atrair rival para a morte é preso horas após o crime na zona Leste de Manaus,Homicídio,Homicídio consumado,extrema,NA,Homicídio,NA
Exército e PF apreendem 868 kg de maconha tipo skank escondidos em mata no interior do Amazonas,Não classificado com precisão,Requer análise manual,indefinida,NA,Não classificado com precisão,NA
Dupla é presa por despejar entulho em área de preservação ambiental no bairro Ponta Negra,Não classificado com precisão,Requer análise manual,indefinida,NA,Não classificado com precisão,NA
Polícia prende homem por cerca de seis roubos a ônibus e apreende 18 aparelhos eletrônicos,Roubo/Assalto,Roubo/assalto com confronto,alta,NA,Roubo/Assalto,NA
"Em São Paulo de Olivença, PC-AM prende homem por estupro da própria prima",Estupro,Estupro consumado,extrema,NA,Estupro,NA
MP do Amazonas deflagra operação “Fogo Amigo” para combater tráfico de armas de uso restrito,Tráfico de Drogas/Facções,Tráfico associado a facção criminosa,alta,NA,Tráfico de Drogas/Facções,NA
CDC Manicoré e Penarol empatam em 1 a 1 na Segundinha,Não classificado com precisão,Requer análise manual,indefinida,NA,Não classificado com precisão,NA
Polícia Civil deflagra cumpre 51 mandados de prisão por inadimplência de pensão alimentícia,Não classificado com precisão,Requer análise manual,indefinida,NA,Não classificado com precisão,NA
Cinco suspeitos são presos por envolvimento em série de roubos em Manaus,Roubo/Assalto,Roubo/assalto com confronto,alta,NA,Roubo/Assalto,NA
Traficante é preso com 3 kg de maconha em Boca do Acre,Não classificado com precisão,Requer análise manual,indefinida,NA,Não classificado com precisão,NA
Homem é preso por tentar assassinar e esposa na frente dos filhos,Homicídio,Homicídio consumado,extrema,NA,Homicídio,NA
"Adolescente de 17 anos é apreendido por mais de 10 ocorrências policiais, como porte de arma e roubo",Roubo/Assalto,Roubo/assalto com confronto,alta,NA,Roubo/Assalto,NA
Dupla é presa após sequestrar três mulheres na zona oeste de Manaus,Não classificado com precisão,Requer análise manual,indefinida,NA,Não classificado com precisão,NA
Justiça mantém a prisão do MC Poze do Rodo por 30 dias,Não classificado com precisão,Requer análise manual,indefinida,NA,Não classificado com precisão,NA
Polícia Civil divulga imagem de suspeito de furtar hidrômetro no bairro Coroado,Não classificado com precisão,Requer análise manual,indefinida,NA,Não classificado com precisão,NA
Mulher é presa apó transferir mais de R$ 1 mi via pix sem autorização de vítima,Não classificado com precisão,Requer análise manual,indefinida,NA,Não classificado com precisão,NA
"Em Novo Aripuanã, PC prende homem após agressão física contra companheira",Não classificado com precisão,Requer análise manual,indefinida,NA,Não classificado com precisão,NA
Padrasto é preso por estuprar enteada de 22 anos em São Gabriel da Cachoeira,Não classificado com precisão,Requer análise manual,indefinida,NA,Não classificado com precisão,NA
Adolescente é apreendido com cocaína e dinheiro no Colônia Terra Nova,Não classificado com precisão,Requer análise manual,indefinida,NA,Não classificado com precisão,NA
Anuário aponta queda nos homicídios e aumento de estupro contra crianças no Amazonas,Homicídio,Homicídio consumado,extrema,NA,Homicídio,NA
MC Thiago Braga é assassinado com golpe de facão na zona sul de Manaus,Homicídio,Homicídio consumado,extrema,NA,Homicídio,NA
"Polícia prende ‘Dama do Tráfico’, ligada a chefes do crime do AM",Tráfico de Drogas/Facções,Tráfico associado a facção criminosa,alta,NA,Tráfico de Drogas/Facções,NA
